"location","city","country","address","latitude","longitude","co2_kg","distance_km","plane trips_amount","train trips_amount"
"Beirut,  Lebanon","Beirut"," Lebanon","Beirut, Beirut Governorate, Lebanon","33.8959203","35.47843","0.0","0.0","0","67"
"Larnaca Municipality,  Cyprus","Larnaca Municipality"," Cyprus","Larnaca Municipality, Larnaca District, South Cyprus, Cyprus","34.9236095","33.6236184","821.197","27464.797","0","67"
"Tel Aviv-Yafo,  Israel","Tel Aviv-Yafo"," Israel","Tel Aviv-Yafo, Tel Aviv Subdistrict, Tel Aviv District, Israel","32.0852997","34.7818064","847.612","28348.229","0","67"
"Amman,  Jordan","Amman"," Jordan","Amman, 2062, Jordan","31.9515694","35.9239625","882.11","29502.013","0","67"
"Pafos,  Cyprus","Pafos"," Cyprus","Pafos, Paphos Municipality, Paphos District, South Cyprus, 8047, Cyprus","34.7743988","32.4231586","1190.112","39803.063","0","67"
"Cairo,  Egypt","Cairo"," Egypt","Cairo, Cairo Governorate, Egypt","30.0443879","31.2357257","19177.691","78528.428","67","0"
"Baghdad,  Iraq","Baghdad"," Iraq","Baghdad, Al-Karkh Central Subdistrict, Al-Karkh District, Baghdad Governorate, Iraq","33.3024309","44.3787992","25337.162","110778.678","67","0"
"Istanbul,  Turkey","Istanbul"," Turkey","Istanbul, Fatih, Istanbul, Marmara Region, 34126, Turkey","41.0096334","28.9651646","28941.01","130947.012","67","0"
"Yerevan,  Armenia","Yerevan"," Armenia","Yerevan, Armenia","40.1776121","44.5125849","30270.031","142360.805","67","0"
"Athens,  Greece","Athens"," Greece","Athens, Municipality of Athens, Regional Unit of Central Athens, Attica, 10667, Greece","37.9839412","23.7283052","31640.737","154132.595","67","0"
"Tbilisi,  Georgia","Tbilisi"," Georgia","Tbilisi, Georgia","41.6934591","44.8014495","32282.568","159644.712","67","0"
"Kuwait City,  Kuwait","Kuwait City"," Kuwait","Kuwait City, Al Asimah, 15005, Kuwait","29.3797091","47.9735629","33726.006","172041.137","67","0"
"Bucharest,  Romania","Bucharest"," Romania","Bucharest, Romania","44.4361414","26.1027202","35981.519","190490.786","67","0"
"Sofia,  Bulgaria","Sofia"," Bulgaria","Sofia, Sofia City, Sofia-City, Bulgaria","42.6978634","23.3221789","36382.795","193039.539","67","0"
"Baku,  Azerbaijan","Baku"," Azerbaijan","Baku, Yasamal Raion, Baku City, Absheron, Azerbaijan","40.3754434","49.8326748","36830.226","195585.716","67","0"
"Tehran,  Iran","Tehran"," Iran","Tehran, بخش مرکزی شهرستان تهران, Tehran County, Tehran Province, Iran","35.6892523","51.3896004","36955.303","196297.482","67","0"
"Skopje,  North Macedonia","Skopje"," North Macedonia","Skopje, Municipality of Centar, City of Skopje, Skopje Region, North Macedonia","41.9960924","21.4316495","38314.352","204031.364","67","0"
"Tirana,  Albania","Tirana"," Albania","Tirana, Tirana Municipally, Tirana County, Central Albania, 1001-1028, Albania","41.3279485","19.8185512","40237.918","214977.713","67","0"
"Dammam Governorate,  Saudi Arabia","Dammam Governorate"," Saudi Arabia","Dammam Governorate, Eastern Region, Saudi Arabia","26.4367824","50.1039991","40840.203","218405.11","67","0"
"Manama,  Bahrain","Manama"," Bahrain","Manama, Capital Governorate, 308, Bahrain","26.2235041","50.5822436","42082.715","225475.818","67","0"
"Podgorica,  Montenegro","Podgorica"," Montenegro","Podgorica, Podgorica Capital City, Montenegro","42.4415238","19.2621081","42538.638","228070.318","67","0"
"Belgrade,  Serbia","Belgrade"," Serbia","Belgrade, Stari Grad Urban Municipality, City of Belgrade, Central Serbia, 11000, Serbia","44.8178131","20.4568974","44078.744","236834.528","67","0"
"Doha,  Qatar","Doha"," Qatar","Doha, Qatar","25.2856329","51.5264162","45312.229","243853.866","67","0"
"City of Sarajevo,  Bosnia and Herzegovina","City of Sarajevo"," Bosnia and Herzegovina","City of Sarajevo, Sarajevo Canton, Federation of Bosnia and Herzegovina, Bosnia and Herzegovina","43.8519774","18.3866868","45829.501","246797.484","67","0"
"Kyiv,  Ukraine","Kyiv"," Ukraine","Kyiv, Ukraine","50.4500336","30.5241361","46832.988","252507.981","67","0"
"Valletta,  Malta","Valletta"," Malta","Valletta, South Eastern Region, Malta","35.8989818","14.5136759","47699.171","257437.134","67","0"
"Budapest,  Hungary","Budapest"," Hungary","Budapest, V. kerület, Central Hungary, Hungary","47.4983815","19.0404707","50565.292","273747.24","67","0"
"Khartoum,  Sudan","Khartoum"," Sudan","Khartoum, Khartoum State, 11111, Sudan","15.5635972","32.5349123","50961.754","276003.365","67","0"
"Tripoli,  Libya","Tripoli"," Libya","Tripoli, سوق الجمعة, Tripoli, Libya","32.896672","13.1777923","51184.919","277273.321","67","0"
"Ashgabat,  Turkmenistan","Ashgabat"," Turkmenistan","Ashgabat, Turkmenistan","37.9404648","58.3823487","52033.956","282104.897","67","0"
"Dubai,  United Arab Emirates","Dubai"," United Arab Emirates","Dubai, 39205, United Arab Emirates","25.2653471","55.2924914","52796.877","286446.422","67","0"
"Rome,  Italy","Rome"," Italy","Rome, Roma Capitale, Lazio, Italy","41.8933203","12.4829321","54173.624","294281.013","67","0"
"Bratislava,  Slovakia","Bratislava"," Slovakia","Bratislava, Region of Bratislava, Slovakia","48.1516988","17.1093063","54256.083","294750.259","67","0"
"Ljubljana,  Slovenia","Ljubljana"," Slovenia","Ljubljana, Upravna Enota Ljubljana, 1000, Slovenia","46.0499803","14.5068602","54945.209","298671.839","67","0"
"Vienna,  Austria","Vienna"," Austria","Vienna, Austria","48.2083537","16.3725042","55352.206","300987.917","67","0"
"Minsk,  Belarus","Minsk"," Belarus","Minsk, Belarus","53.902334","27.5618791","56856.873","309518.797","67","0"
"Warsaw,  Poland","Warsaw"," Poland","Warsaw, Masovian Voivodeship, Poland","52.2319581","21.0067249","57663.075","314051.324","67","0"
"Tunisia, Tunisia","Tunisia","Tunisia","Tunisia","33.8439408","9.400138","59033.493","321755.911","67","0"
"Moscow,  Russia","Moscow"," Russia","Moscow, Central Federal District, Russia","55.7504461","37.6174943","59856.205","326381.255","67","0"
"Vilnius,  Lithuania","Vilnius"," Lithuania","Vilnius, Vilnius city municipality, Vilnius County, Lithuania","54.6870458","25.2829111","60060.273","327528.542","67","0"
"Prague,  Czechia","Prague"," Czechia","Prague, Czechia","50.0874654","14.4212535","61079.647","333259.535","67","0"
"Muscat,  Oman","Muscat"," Oman","Muscat, Oman","23.5882019","58.3829448","61432.651","335244.148","67","0"
"Zurich,  Switzerland","Zurich"," Switzerland","Zurich, District Zurich, Zurich, Switzerland","47.3744489","8.5410422","66180.502","361936.898","67","0"
"Riga,  Latvia","Riga"," Latvia","Riga, Vidzeme, Latvia","56.9493977","24.1051846","66261.181","362390.482","67","0"
"Berlin,  Germany","Berlin"," Germany","Berlin, 10117, Germany","52.5170365","13.3888599","66509.961","363789.142","67","0"
"Addis Ababa,  Ethiopia","Addis Ababa"," Ethiopia","Addis Ababa, 1138, Ethiopia","9.0107934","38.7612525","68239.345","373511.86","67","0"
"Hargeisa,  Somalia","Hargeisa"," Somalia","Hargeisa, Hargeisa District, Woqooyi Galbeed, 1100, Somalia","9.561733","44.061803","69594.833","381132.505","67","0"
"Saint Petersburg,  Russia","Saint Petersburg"," Russia","Saint Petersburg, Northwestern Federal District, 190000, Russia","59.938732","30.316229","71404.775","391308.126","67","0"
"Tallinn,  Estonia","Tallinn"," Estonia","Tallinn, Harju maakond, Estonia","59.4372155","24.7453688","72050.218","394936.855","67","0"
"Luxembourg, Luxembourg","Luxembourg","Luxembourg","Luxembourg","49.8158683","6.1296751","72723.111","398719.909","67","0"
"Copenhagen,  Denmark","Copenhagen"," Denmark","Copenhagen, Copenhagen Municipality, Capital Region of Denmark, 1357, Denmark","55.6867243","12.5700724","73148.292","401110.301","67","0"
"Helsinki,  Finland","Helsinki"," Finland","Helsinki, Helsinki sub-region, Uusimaa, Southern Finland, Mainland Finland, Finland","60.1674881","24.9427473","73781.455","404669.989","67","0"
"Tashkent,  Uzbekistan","Tashkent"," Uzbekistan","Tashkent, 100128, Uzbekistan","41.3123363","69.2787079","74933.454","411146.61","67","0"
"Stockholm,  Sweden","Stockholm"," Sweden","Stockholm, Stockholms kommun, Stockholm County, 111 29, Sweden","59.3251172","18.0710935","75759.746","415792.084","67","0"
"Brussels,  Belgium","Brussels"," Belgium","Brussels, City of Brussels, Brussels-Capital, Belgium","50.8465573","4.351697","76606.181","420550.798","67","0"
"Amsterdam,  Netherlands","Amsterdam"," Netherlands","Amsterdam, North Holland, Netherlands","52.3727598","4.8936041","77611.797","426204.444","67","0"
"N'Djamena,  Chad","N'Djamena"," Chad","N'Djamena, Chad","12.1191543","15.0502758","77722.998","426829.621","67","0"
"Paris,  France","Paris"," France","Paris, Ile-de-France, Metropolitan France, France","48.8566969","2.3514616","77806.044","427296.514","67","0"
"Juba,  South Sudan","Juba"," South Sudan","Juba, Central Equatoria, PRIVATE BAG, South Sudan","4.8472017","31.5951655","79382.071","436157.05","67","0"
"Oslo,  Norway","Oslo"," Norway","Oslo, Norway","59.9133301","10.7389701","82028.849","456400.278","67","0"
"Islamabad,  Pakistan","Islamabad"," Pakistan","Islamabad, Islamabad Capital Territory, 44000, Pakistan","33.6938118","73.0651511","82537.745","462771.8","67","0"
"London,  United Kingdom","London"," United Kingdom","London, Greater London, England, United Kingdom","51.5073219","-0.1276474","82551.481","462943.775","67","0"
"Nur-Sultan,  Kazakhstan","Nur-Sultan"," Kazakhstan","Nur-Sultan, Kazakhstan","51.1282205","71.4306682","82638.668","464035.383","67","0"
"Madrid,  Spain","Madrid"," Spain","Madrid, Área metropolitana de Madrid y Corredor del Henares, Community of Madrid, 28001, Spain","40.4167047","-3.7035825","83221.119","471327.828","67","0"
"Bishkek,  Kyrgyzstan","Bishkek"," Kyrgyzstan","Bishkek, Kyrgyzstan","42.8765615","74.6070079","83235.005","471501.695","67","0"
"Kampala,  Uganda","Kampala"," Uganda","Kampala, Central Region, Uganda","0.3177137","32.5813539","83983.403","501955.157","67","0"
"Dublin,  Ireland","Dublin"," Ireland","Dublin, Dublin 1, Leinster, Ireland","53.3497645","-6.2602732","86886.22","524475.63","67","0"
"Nairobi,  Kenya","Nairobi"," Kenya","Nairobi, Kenya","-1.3031689499999999","36.826061224105075","86940.37","524811.254","67","0"
"Casablanca,  Morocco","Casablanca"," Morocco","Casablanca, Pachalik de Casablanca, Prefecture of Casablanca, Casablanca-Settat, Morocco","33.5950627","-7.6187768","87768.697","529945.238","67","0"
"New Delhi,  India","New Delhi"," India","New Delhi, Delhi, India","28.6138954","77.2090057","88374.256","533698.501","67","0"
"Lisbon,  Portugal","Lisbon"," Portugal","Lisbon, Grande Lisboa, Área Metropolitana de Lisboa, Portugal","38.7077507","-9.1365919","88620.799","535226.585","67","0"
"Kigali,  Rwanda","Kigali"," Rwanda","Kigali, Nyarugenge District, Kigali City, 2079, Rwanda","-1.950851","30.061507","89310.174","539499.341","67","0"
"Niamey,  Niger","Niamey"," Niger","Niamey, 8001, Niger","13.524834","2.109823","89882.979","543049.595","67","0"
"Zanzibar,  Tanzania","Zanzibar"," Tanzania","Zanzibar, Tanzania","-6.09994425","39.32094431715264","98814.001","598404.231","67","0"
"Lagos,  Nigeria","Lagos"," Nigeria","Lagos, Lagos Island, Lagos, 100242, Nigeria","6.4550575","3.3941795","99393.542","601996.237","67","0"
"Congo,  Democratic Republic of the Congo","Congo"," Democratic Republic of the Congo","Congo, Ngaliema, Kinshasa, 24302, Democratic Republic of the Congo","-4.36642155","15.25859008539669","105067.226","637161.828","67","0"
"Kathmandu,  Nepal","Kathmandu"," Nepal","Kathmandu, Kamaladi Marg, Kamalpokhari, Baghbazar, Kathmandu, Bagmati Pradesh, 46600, Nepal","27.708317","85.3205817","105261.599","638366.556","67","0"
"Mahé,  Seychelles","Mahé"," Seychelles","Mahé, Seychelles","-4.68379555","55.49263800753758","105552.932","640172.244","67","0"
"Bamako,  Mali","Bamako"," Mali","Bamako, Kati Cercle, Koulikoro, Mali","12.61326555","-7.984739136241295","109939.597","667360.876","67","0"
"Reykjavik,  Iceland","Reykjavik"," Iceland","Reykjavik, Capital Region, Iceland","64.145981","-21.9422367","112445.363","682891.657","67","0"
"Malé,  Maldives","Malé"," Maldives","Malé, Maldives","4.1779879","73.5107387","113226.679","687734.266","67","0"
"Luanda,  Angola","Luanda"," Angola","Luanda, Municipality of Luanda, Luanda Province, Angola","-8.8272699","13.2439512","116818.998","709999.522","67","0"
"Nouakchott,  Mauritania","Nouakchott"," Mauritania","Nouakchott, المفترق, `Arafat, Nouakchott, Mauritania","18.0629628","-15.962910646085763","118459.183","720165.419","67","0"
"Dhaka,  Bangladesh","Dhaka"," Bangladesh","Dhaka, Chanpara Bazar, Dhaka District, Dhaka Division, 1230, Bangladesh","23.810651","90.4126466","119078.883","724006.331","67","0"
"Colombo,  Sri Lanka","Colombo"," Sri Lanka","Colombo, Main Street, Gas Paha Junction, Kochchikade, St. Bastian, Colombo, Colombo District, Western Province, 01100, Sri Lanka","6.9387469","79.8541134","120014.879","729807.653","67","0"
"Lusaka,  Zambia","Lusaka"," Zambia","Lusaka, Lusaka District, Lusaka Province, 10101, Zambia","-15.4164488","28.2821535","121955.024","741832.704","67","0"
"Monrovia,  Liberia","Monrovia"," Liberia","Monrovia, Greater Monrovia, Montserrado County, 231, Liberia","6.328034","-10.797788","124450.641","757300.583","67","0"
"Dakar,  Senegal","Dakar"," Senegal","Dakar, 2084, Senegal","14.693425","-17.447938","125550.452","764117.23","67","0"
"Freetown,  Sierra Leone","Freetown"," Sierra Leone","Freetown, Western Area Urban, Western Area, 00232, Sierra Leone","8.479004","-13.26795","125886.038","766197.202","67","0"
"Harare,  Zimbabwe","Harare"," Zimbabwe","Harare, Harare Province, 04-263, Zimbabwe","-17.831773","31.045686","127034.786","773317.163","67","0"
"Ulaanbaatar,  Mongolia","Ulaanbaatar"," Mongolia","Ulaanbaatar, Mongolia","47.94909925","107.02225913456641","131686.105","802146.118","67","0"
"Antananarivo,  Madagascar","Antananarivo"," Madagascar","Antananarivo, Analamanga, Province d’Antananarivo, 101, Madagascar","-18.9100122","47.5255809","132179.061","805201.469","67","0"
"Espargos,  Cape Verde","Espargos"," Cape Verde","Espargos, Sal, 4110, Cape Verde","16.7577983","-22.9431454","133909.817","815928.73","67","0"
"Yangon,  Myanmar","Yangon"," Myanmar","Yangon, Western District, Yangon, 11000, Myanmar","16.7967129","96.1609916","138371.512","843582.391","67","0"
"Port Louis,  Mauritius","Port Louis"," Mauritius","Port Louis, 11317, Mauritius","-20.1624522","57.5028044","141670.092","864027.049","67","0"
"Gaborone,  Botswana","Gaborone"," Botswana","Gaborone, South-East District, 09267, Botswana","-24.6581357","25.9088474","144719.814","882929.285","67","0"
"Distrito Municipal de KaMpfumo,  Mozambique","Distrito Municipal de KaMpfumo"," Mozambique","Distrito Municipal de KaMpfumo, Maputo, Mozambique","-25.966213","32.56745","146329.236","892904.51","67","0"
"Bangkok,  Thailand","Bangkok"," Thailand","Bangkok, Phra Borom Maha Ratchawang Subdistrict, Phra Nakhon District, Bangkok, 10200, Thailand","13.7544238","100.4930399","150741.658","920252.78","67","0"
"Hanoi,  Vietnam","Hanoi"," Vietnam","Hanoi, Vietnam","21.0294498","105.8544441","152738.089","932626.692","67","0"
"Beijing,  China","Beijing"," China","Beijing, 100051, China","39.906217","116.3912757","153046.672","934539.295","67","0"
"Phnom Penh,  Cambodia","Phnom Penh"," Cambodia","Phnom Penh, Khan Daun Penh, Phnom Penh, 11213, Cambodia","11.568271","104.9224426","162341.226","992147.111","67","0"
"Municipality of Macau,  China","Municipality of Macau"," China","Municipality of Macau, Macau, China","22.1899448","113.5380454","166476.597","1017778.211","67","0"
"Kuala Lumpur,  Malaysia","Kuala Lumpur"," Malaysia","Kuala Lumpur, Malaysia","3.1516964","101.6942371","167177.111","1022120.012","67","0"
"Hong Kong Island,  China","Hong Kong Island"," China","Hong Kong Island, Hong Kong, China","22.2793278","114.1628131","167586.553","1024657.742","67","0"
"Cape Town,  South Africa","Cape Town"," South Africa","Cape Town, City of Cape Town, Western Cape, 8001, South Africa","-33.928992","18.417396","169797.839","1038363.328","67","0"
"Khabarovsk Krai,  Russia","Khabarovsk Krai"," Russia","Khabarovsk Krai, Far Eastern Federal District, Russia","51.6312684","136.121524","170537.907","1042950.286","67","0"
"Seoul,  South Korea","Seoul"," South Korea","Seoul, Nowon-gu, South Korea","37.5666791","126.9782914","173355.869","1060416.063","67","0"
"Singapore, Singapore","Singapore","Singapore","Singapore","1.357107","103.8194992","173837.712","1063402.535","67","0"
"Taipei,  Taiwan","Taipei"," Taiwan","Taipei, Taiwan","25.0375198","121.5636796","178480.356","1092177.725","67","0"
"Lal-lo,  Philippines","Lal-lo"," Philippines","Lal-lo, Cagayan, Cagayan Valley, 3509, Philippines","18.2000513","121.661997","187132.649","1145804.793","67","0"
"Jakarta Special Capital Region,  Indonesia","Jakarta Special Capital Region"," Indonesia","Jakarta Special Capital Region, Indonesia","-6.1753942","106.827183","190340.905","1165689.621","67","0"
"Manila,  Philippines","Manila"," Philippines","Manila, Capital District, Metro Manila, Philippines","14.5907332","120.9809674","190403.752","1166079.15","67","0"
"Cagayan de Oro,  Philippines","Cagayan de Oro"," Philippines","Cagayan de Oro, Alabang Hills Village, Muntinlupa, Southern Manila District, Metro Manila, 1771, Philippines","14.4373834","121.0303195","190697.942","1167902.543","67","0"
"Bandar Seri Begawan,  Brunei","Bandar Seri Begawan"," Brunei","Bandar Seri Begawan, Mukim Kianggeh, Brunei-Muara District, BS8711, Brunei","4.8895453","114.9417574","191065.798","1170182.522","67","0"
"Tokyo,  Japan","Tokyo"," Japan","Tokyo, Japan","35.6828387","139.7594549","196636.277","1204708.449","67","0"
"New York,  United States","New York"," United States","New York, United States","40.7127281","-74.0060152","197345.144","1209102.018","67","0"
"Toronto,  Canada","Toronto"," Canada","Toronto, Golden Horseshoe, Ontario, Canada","43.6534817","-79.3839347","200328.183","1227590.952","67","0"
"Pointe-à-Pitre,  France","Pointe-à-Pitre"," France","Pointe-à-Pitre, Guadeloupe, 97110, France","16.23579555","-61.53207278338337","210544.035","1290908.983","67","0"
"Chicago,  United States","Chicago"," United States","Chicago, Cook County, Illinois, United States","41.8755616","-87.6244212","213844.887","1311367.722","67","0"
"San Juan,  United States","San Juan"," United States","San Juan, Puerto Rico, United States","18.465299","-66.116666","216094.696","1325312.078","67","0"
"Punta Cana,  Dominican Republic","Punta Cana"," Dominican Republic","Punta Cana, Higüey, La Altagracia, 23300, Dominican Republic","18.556551","-68.3691611","220123.451","1350282.374","67","0"
"Santo Domingo,  Dominican Republic","Santo Domingo"," Dominican Republic","Santo Domingo, Distrito Nacional, Dominican Republic","18.4801972","-69.942111","223113.1","1368812.275","67","0"
"Nassau,  The Bahamas","Nassau"," The Bahamas","Nassau, New Providence, 242, The Bahamas","25.0783456","-77.3383331","226229.276","1388126.386","67","0"
"Rio de Janeiro,  Brazil","Rio de Janeiro"," Brazil","Rio de Janeiro, Região Geográfica Imediata do Rio de Janeiro, Região Metropolitana do Rio de Janeiro, Região Geográfica Intermediária do Rio de Janeiro, Rio de Janeiro, Southeast Region, 20260-080, Brazil","-22.9110137","-43.2093727","227881.816","1398368.861","67","0"
"Caracas,  Venezuela","Caracas"," Venezuela","Caracas, Parroquia Catedral, Municipio Libertador, Capital District, Venezuela","10.506098","-66.9146017","228756.456","1403789.892","67","0"
"Vancouver,  Canada","Vancouver"," Canada","Vancouver, District of North Vancouver, British Columbia, Canada","49.2608724","-123.1139529","229904.706","1410906.77","67","0"
"Kingston,  Jamaica","Kingston"," Jamaica","Kingston, Surrey County, KINGSTON, Jamaica","17.9712148","-76.7928128","236191.396","1449871.788","67","0"
"Hagåtña,  United States","Hagåtña"," United States","Hagåtña, Sinajana Municipality, Guam, United States","13.4727446","144.75201822544284","237489.924","1457920.087","67","0"
"Havana,  Cuba","Havana"," Cuba","Havana, Cuba","23.135305","-82.3589631","237601.726","1458613.038","67","0"
"New Orleans,  United States","New Orleans"," United States","New Orleans, Orleans Parish, Louisiana, United States","29.9499323","-90.0701156","237936.298","1460686.722","67","0"
"George Town,  Cayman Islands","George Town"," Cayman Islands","George Town, KY1-9000, Cayman Islands","19.2953549","-81.3807776","242111.976","1486567.648","67","0"
"Bogota,  Colombia","Bogota"," Colombia","Bogota, Bogota Capital District, 11001, Colombia","4.6533326","-74.083652","250844.166","1540689.919","67","0"
"Tocumen,  Panama","Tocumen"," Panama","Tocumen, Distrito Panamá, Panamá, Panama","9.0920363","-79.3816691","254349.959","1562418.886","67","0"
"Santa Cruz,  Bolivia","Santa Cruz"," Bolivia","Santa Cruz, Bolivia","-17.333333","-61.5","255201.807","1567698.654","67","0"
"Belize City,  Belize","Belize City"," Belize","Belize City, Belize District, Belize","17.5000543","-88.2003115","256469.552","1575556.161","67","0"
"Los Angeles,  United States","Los Angeles"," United States","Los Angeles, Los Angeles County, California, United States","34.0536909","-118.242766","261224.409","1605026.847","67","0"
"Liberia,  Costa Rica","Liberia"," Costa Rica","Liberia, Cantón Liberia, Provincia Guanacaste, 50101, Costa Rica","10.6333401","-85.4362722","262944.63","1615688.81","67","0"
"San Salvador,  El Salvador","San Salvador"," El Salvador","San Salvador, Ayutuxtepeque, Departamento de San Salvador, CP-1101, El Salvador","13.6989939","-89.1914249","264464.581","1625109.491","67","0"
"Guatemala City,  Guatemala","Guatemala City"," Guatemala","Guatemala City, Guatemala Department, 01004, Guatemala","14.6222328","-90.5185188","265135.767","1629269.519","67","0"
"Montevideo,  Uruguay","Montevideo"," Uruguay","Montevideo, Uruguay","-34.9058916","-56.1913095","266259.89","1636236.853","67","0"
"Quito,  Ecuador","Quito"," Ecuador","Quito, Pichincha, 17041, Ecuador","-0.2201641","-78.5123274","266358.125","1636845.712","67","0"
"Autonomous City of Buenos Aires,  Argentina","Autonomous City of Buenos Aires"," Argentina","Autonomous City of Buenos Aires, Comuna 6, Autonomous City of Buenos Aires, Argentina","-34.6075682","-58.4370894","269854.051","1658513.522","67","0"
"Mexico City,  Mexico","Mexico City"," Mexico","Mexico City, Mexico","19.4326296","-99.1331785","269972.805","1659249.565","67","0"
"Port Moresby,  Papua New Guinea","Port Moresby"," Papua New Guinea","Port Moresby, National Capital District, Southern Region, 111, Papua New Guinea","-9.4743301","147.1599504","274451.067","1687005.912","67","0"
"Lima,  Peru","Lima"," Peru","Lima, Province of Lima, Lima Metropolitan Area, Lima, Peru","-12.0621065","-77.0365256","279451.415","1717998.158","67","0"
"Santiago,  Chile","Santiago"," Chile","Santiago, Provincia de Santiago, Santiago Metropolitan Region, Chile","-33.4377756","-70.6504502","290704.499","1787744.975","67","0"
"Honolulu,  United States","Honolulu"," United States","Honolulu, Honolulu County, Hawaii, United States","21.304547","-157.855676","298819.533","1838042.101","67","0"
"Sydney,  Australia","Sydney"," Australia","Sydney, New South Wales, Australia","-33.8548157","151.2164539","308997.631","1901126.138","67","0"
"Auckland,  New Zealand","Auckland"," New Zealand","Auckland, Waitematā, Auckland, 1010, New Zealand","-36.852095","174.7631803","355464.118","2189126.253","67","0"
"Avarua,  Cook Islands","Avarua"," Cook Islands","Avarua, Te-Au-O-Tonga, Rarotonga, Cook Islands","-21.2074736","-159.7708145","390518.986","2406396.952","67","0"
"Papeete,  France","Papeete"," France","Papeete, Windward Islands, French Polynesia, 98714, France","-17.5373835","-149.5659964","394190.793","2429154.878","67","0"