"location","city","country","address","latitude","longitude","co2_kg","distance_km","plane trips_amount","train trips_amount"
"Seoul,  South Korea","Seoul"," South Korea","Seoul, Nowon-gu, South Korea","37.5666791","126.9782914","776.278","25962.47","0","67"
"Beijing,  China","Beijing"," China","Beijing, 100051, China","39.906217","116.3912757","24881.134","108390.967","67","0"
"Tokyo,  Japan","Tokyo"," Japan","Tokyo, Japan","35.6828387","139.7594549","33842.012","173037.41","67","0"
"Taipei,  Taiwan","Taipei"," Taiwan","Taipei, Taiwan","25.0375198","121.5636796","40210.585","214822.174","67","0"
"Khabarovsk Krai,  Russia","Khabarovsk Krai"," Russia","Khabarovsk Krai, Far Eastern Federal District, Russia","51.6312684","136.121524","40528.355","216630.492","67","0"
"Ulaanbaatar,  Mongolia","Ulaanbaatar"," Mongolia","Ulaanbaatar, Mongolia","47.94909925","107.02225913456641","44859.721","241278.801","67","0"
"Hong Kong Island,  China","Hong Kong Island"," China","Hong Kong Island, Hong Kong, China","22.2793278","114.1628131","53362.162","289663.259","67","0"
"Municipality of Macau,  China","Municipality of Macau"," China","Municipality of Macau, Macau, China","22.1899448","113.5380454","54290.227","294944.559","67","0"
"Lal-lo,  Philippines","Lal-lo"," Philippines","Lal-lo, Cagayan, Cagayan Valley, 3509, Philippines","18.2000513","121.661997","57769.033","314647.03","67","0"
"Manila,  Philippines","Manila"," Philippines","Manila, Capital District, Metro Manila, Philippines","14.5907332","120.9809674","67487.239","369283.463","67","0"
"Hanoi,  Vietnam","Hanoi"," Vietnam","Hanoi, Vietnam","21.0294498","105.8544441","67503.158","369372.963","67","0"
"Cagayan de Oro,  Philippines","Cagayan de Oro"," Philippines","Cagayan de Oro, Alabang Hills Village, Muntinlupa, Southern Manila District, Metro Manila, 1771, Philippines","14.4373834","121.0303195","67869.54","371432.79","67","0"
"Hagåtña,  United States","Hagåtña"," United States","Hagåtña, Sinajana Municipality, Guam, United States","13.4727446","144.75201822544284","81948.619","455395.774","67","0"
"Phnom Penh,  Cambodia","Phnom Penh"," Cambodia","Phnom Penh, Khan Daun Penh, Phnom Penh, 11213, Cambodia","11.568271","104.9224426","83323.585","493226.47","67","0"
"Dhaka,  Bangladesh","Dhaka"," Bangladesh","Dhaka, Chanpara Bazar, Dhaka District, Dhaka Division, 1230, Bangladesh","23.810651","90.4126466","83753.161","498909.311","67","0"
"Bangkok,  Thailand","Bangkok"," Thailand","Bangkok, Phra Borom Maha Ratchawang Subdistrict, Phra Nakhon District, Bangkok, 10200, Thailand","13.7544238","100.4930399","83964.551","501705.766","67","0"
"Yangon,  Myanmar","Yangon"," Myanmar","Yangon, Western District, Yangon, 11000, Myanmar","16.7967129","96.1609916","84367.584","507037.463","67","0"
"Kathmandu,  Nepal","Kathmandu"," Nepal","Kathmandu, Kamaladi Marg, Kamalpokhari, Baghbazar, Kathmandu, Bagmati Pradesh, 46600, Nepal","27.708317","85.3205817","87077.976","525664.135","67","0"
"Bandar Seri Begawan,  Brunei","Bandar Seri Begawan"," Brunei","Bandar Seri Begawan, Mukim Kianggeh, Brunei-Muara District, BS8711, Brunei","4.8895453","114.9417574","87620.358","529025.833","67","0"
"Bishkek,  Kyrgyzstan","Bishkek"," Kyrgyzstan","Bishkek, Kyrgyzstan","42.8765615","74.6070079","94158.872","569551.659","67","0"
"Nur-Sultan,  Kazakhstan","Nur-Sultan"," Kazakhstan","Nur-Sultan, Kazakhstan","51.1282205","71.4306682","96587.866","584606.603","67","0"
"New Delhi,  India","New Delhi"," India","New Delhi, Delhi, India","28.6138954","77.2090057","101167.656","612992.223","67","0"
"Kuala Lumpur,  Malaysia","Kuala Lumpur"," Malaysia","Kuala Lumpur, Malaysia","3.1516964","101.6942371","103257.54","625945.362","67","0"
"Islamabad,  Pakistan","Islamabad"," Pakistan","Islamabad, Islamabad Capital Territory, 44000, Pakistan","33.6938118","73.0651511","103646.797","628357.988","67","0"
"Tashkent,  Uzbekistan","Tashkent"," Uzbekistan","Tashkent, 100128, Uzbekistan","41.3123363","69.2787079","104294.25","632370.915","67","0"
"Singapore, Singapore","Singapore","Singapore","Singapore","1.357107","103.8194992","104807.056","635549.294","67","0"
"Jakarta Special Capital Region,  Indonesia","Jakarta Special Capital Region"," Indonesia","Jakarta Special Capital Region, Indonesia","-6.1753942","106.827183","118791.959","722227.971","67","0"
"Ashgabat,  Turkmenistan","Ashgabat"," Turkmenistan","Ashgabat, Turkmenistan","37.9404648","58.3823487","126006.16","766941.719","67","0"
"Colombo,  Sri Lanka","Colombo"," Sri Lanka","Colombo, Main Street, Gas Paha Junction, Kochchikade, St. Bastian, Colombo, Colombo District, Western Province, 01100, Sri Lanka","6.9387469","79.8541134","127764.726","777841.34","67","0"
"Port Moresby,  Papua New Guinea","Port Moresby"," Papua New Guinea","Port Moresby, National Capital District, Southern Region, 111, Papua New Guinea","-9.4743301","147.1599504","128290.168","781098.043","67","0"
"Baku,  Azerbaijan","Baku"," Azerbaijan","Baku, Yasamal Raion, Baku City, Absheron, Azerbaijan","40.3754434","49.8326748","138104.986","841930.461","67","0"
"Tehran,  Iran","Tehran"," Iran","Tehran, بخش مرکزی شهرستان تهران, Tehran County, Tehran Province, Iran","35.6892523","51.3896004","140477.758","856636.944","67","0"
"Moscow,  Russia","Moscow"," Russia","Moscow, Central Federal District, Russia","55.7504461","37.6174943","140929.458","859436.585","67","0"
"Muscat,  Oman","Muscat"," Oman","Muscat, Oman","23.5882019","58.3829448","142340.956","868185.08","67","0"
"Malé,  Maldives","Malé"," Maldives","Malé, Maldives","4.1779879","73.5107387","143237.835","873743.952","67","0"
"Tbilisi,  Georgia","Tbilisi"," Georgia","Tbilisi, Georgia","41.6934591","44.8014495","144905.072","884077.513","67","0"
"Saint Petersburg,  Russia","Saint Petersburg"," Russia","Saint Petersburg, Northwestern Federal District, 190000, Russia","59.938732","30.316229","145226.682","886070.857","67","0"
"Dubai,  United Arab Emirates","Dubai"," United Arab Emirates","Dubai, 39205, United Arab Emirates","25.2653471","55.2924914","145907.764","890292.215","67","0"
"Yerevan,  Armenia","Yerevan"," Armenia","Yerevan, Armenia","40.1776121","44.5125849","147044.234","897336.081","67","0"
"Helsinki,  Finland","Helsinki"," Finland","Helsinki, Helsinki sub-region, Uusimaa, Southern Finland, Mainland Finland, Finland","60.1674881","24.9427473","150660.09","919747.219","67","0"
"Tallinn,  Estonia","Tallinn"," Estonia","Tallinn, Harju maakond, Estonia","59.4372155","24.7453688","151748.942","926495.945","67","0"
"Doha,  Qatar","Doha"," Qatar","Doha, Qatar","25.2856329","51.5264162","152798.875","933003.449","67","0"
"Manama,  Bahrain","Manama"," Bahrain","Manama, Capital Governorate, 308, Bahrain","26.2235041","50.5822436","153310.22","936172.769","67","0"
"Dammam Governorate,  Saudi Arabia","Dammam Governorate"," Saudi Arabia","Dammam Governorate, Eastern Region, Saudi Arabia","26.4367824","50.1039991","153905.29","939861.027","67","0"
"Kuwait City,  Kuwait","Kuwait City"," Kuwait","Kuwait City, Al Asimah, 15005, Kuwait","29.3797091","47.9735629","153991.402","940394.753","67","0"
"Minsk,  Belarus","Minsk"," Belarus","Minsk, Belarus","53.902334","27.5618791","155334.93","948721.959","67","0"
"Baghdad,  Iraq","Baghdad"," Iraq","Baghdad, Al-Karkh Central Subdistrict, Al-Karkh District, Baghdad Governorate, Iraq","33.3024309","44.3787992","155395.483","949097.269","67","0"
"Riga,  Latvia","Riga"," Latvia","Riga, Vidzeme, Latvia","56.9493977","24.1051846","155540.571","949996.528","67","0"
"Kyiv,  Ukraine","Kyiv"," Ukraine","Kyiv, Ukraine","50.4500336","30.5241361","155814.318","951693.216","67","0"
"Vilnius,  Lithuania","Vilnius"," Lithuania","Vilnius, Vilnius city municipality, Vilnius County, Lithuania","54.6870458","25.2829111","157076.018","959513.255","67","0"
"Stockholm,  Sweden","Stockholm"," Sweden","Stockholm, Stockholms kommun, Stockholm County, 111 29, Sweden","59.3251172","18.0710935","158757.586","969935.645","67","0"
"Honolulu,  United States","Honolulu"," United States","Honolulu, Honolulu County, Hawaii, United States","21.304547","-157.855676","162098.878","990645.032","67","0"
"Oslo,  Norway","Oslo"," Norway","Oslo, Norway","59.9133301","10.7389701","164927.294","1008175.605","67","0"
"Warsaw,  Poland","Warsaw"," Poland","Warsaw, Masovian Voivodeship, Poland","52.2319581","21.0067249","165446.872","1011395.958","67","0"
"Beirut,  Lebanon","Beirut"," Lebanon","Beirut, Beirut Governorate, Lebanon","33.8959203","35.47843","169660.693","1037513.294","67","0"
"Bucharest,  Romania","Bucharest"," Romania","Bucharest, Romania","44.4361414","26.1027202","169697.858","1037743.648","67","0"
"Copenhagen,  Denmark","Copenhagen"," Denmark","Copenhagen, Copenhagen Municipality, Capital Region of Denmark, 1357, Denmark","55.6867243","12.5700724","169728.04","1037930.712","67","0"
"Istanbul,  Turkey","Istanbul"," Turkey","Istanbul, Fatih, Istanbul, Marmara Region, 34126, Turkey","41.0096334","28.9651646","170277.452","1041335.979","67","0"
"Larnaca Municipality,  Cyprus","Larnaca Municipality"," Cyprus","Larnaca Municipality, Larnaca District, South Cyprus, Cyprus","34.9236095","33.6236184","171312.111","1047748.818","67","0"
"Amman,  Jordan","Amman"," Jordan","Amman, 2062, Jordan","31.9515694","35.9239625","171547.328","1049206.692","67","0"
"Tel Aviv-Yafo,  Israel","Tel Aviv-Yafo"," Israel","Tel Aviv-Yafo, Tel Aviv Subdistrict, Tel Aviv District, Israel","32.0852997","34.7818064","173280.193","1059947.023","67","0"
"Pafos,  Cyprus","Pafos"," Cyprus","Pafos, Paphos Municipality, Paphos District, South Cyprus, 8047, Cyprus","34.7743988","32.4231586","173463.112","1061080.758","67","0"
"Berlin,  Germany","Berlin"," Germany","Berlin, 10117, Germany","52.5170365","13.3888599","173803.399","1063189.864","67","0"
"Budapest,  Hungary","Budapest"," Hungary","Budapest, V. kerület, Central Hungary, Hungary","47.4983815","19.0404707","174743.967","1069019.517","67","0"
"Sofia,  Bulgaria","Sofia"," Bulgaria","Sofia, Sofia City, Sofia-City, Bulgaria","42.6978634","23.3221789","176073.779","1077261.719","67","0"
"Bratislava,  Slovakia","Bratislava"," Slovakia","Bratislava, Region of Bratislava, Slovakia","48.1516988","17.1093063","176183.062","1077939.058","67","0"
"Prague,  Czechia","Prague"," Czechia","Prague, Czechia","50.0874654","14.4212535","176430.949","1079475.464","67","0"
"Belgrade,  Serbia","Belgrade"," Serbia","Belgrade, Stari Grad Urban Municipality, City of Belgrade, Central Serbia, 11000, Serbia","44.8178131","20.4568974","176890.763","1082325.398","67","0"
"Vienna,  Austria","Vienna"," Austria","Vienna, Austria","48.2083537","16.3725042","177005.839","1083038.645","67","0"
"Vancouver,  Canada","Vancouver"," Canada","Vancouver, District of North Vancouver, British Columbia, Canada","49.2608724","-123.1139529","177504.345","1086128.39","67","0"
"Reykjavik,  Iceland","Reykjavik"," Iceland","Reykjavik, Capital Region, Iceland","64.145981","-21.9422367","179512.347","1098574.024","67","0"
"Skopje,  North Macedonia","Skopje"," North Macedonia","Skopje, Municipality of Centar, City of Skopje, Skopje Region, North Macedonia","41.9960924","21.4316495","179761.841","1100120.396","67","0"
"City of Sarajevo,  Bosnia and Herzegovina","City of Sarajevo"," Bosnia and Herzegovina","City of Sarajevo, Sarajevo Canton, Federation of Bosnia and Herzegovina, Bosnia and Herzegovina","43.8519774","18.3866868","181118.533","1108529.192","67","0"
"Cairo,  Egypt","Cairo"," Egypt","Cairo, Cairo Governorate, Egypt","30.0443879","31.2357257","182072.241","1114440.292","67","0"
"Podgorica,  Montenegro","Podgorica"," Montenegro","Podgorica, Podgorica Capital City, Montenegro","42.4415238","19.2621081","182094.128","1114575.947","67","0"
"Athens,  Greece","Athens"," Greece","Athens, Municipality of Athens, Regional Unit of Central Athens, Attica, 10667, Greece","37.9839412","23.7283052","182409.494","1116530.594","67","0"
"Ljubljana,  Slovenia","Ljubljana"," Slovenia","Ljubljana, Upravna Enota Ljubljana, 1000, Slovenia","46.0499803","14.5068602","182700.865","1118336.518","67","0"
"Tirana,  Albania","Tirana"," Albania","Tirana, Tirana Municipally, Tirana County, Central Albania, 1001-1028, Albania","41.3279485","19.8185512","183025.148","1120346.426","67","0"
"Amsterdam,  Netherlands","Amsterdam"," Netherlands","Amsterdam, North Holland, Netherlands","52.3727598","4.8936041","183064.735","1120591.789","67","0"
"Luxembourg, Luxembourg","Luxembourg","Luxembourg","Luxembourg","49.8158683","6.1296751","186208.977","1140079.857","67","0"
"Brussels,  Belgium","Brussels"," Belgium","Brussels, City of Brussels, Brussels-Capital, Belgium","50.8465573","4.351697","186289.615","1140579.656","67","0"
"Sydney,  Australia","Sydney"," Australia","Sydney, New South Wales, Australia","-33.8548157","151.2164539","186405.417","1141297.397","67","0"
"Zurich,  Switzerland","Zurich"," Switzerland","Zurich, District Zurich, Zurich, Switzerland","47.3744489","8.5410422","187699.486","1149318.056","67","0"
"Hargeisa,  Somalia","Hargeisa"," Somalia","Hargeisa, Hargeisa District, Woqooyi Galbeed, 1100, Somalia","9.561733","44.061803","188729.039","1155699.248","67","0"
"Mahé,  Seychelles","Mahé"," Seychelles","Mahé, Seychelles","-4.68379555","55.49263800753758","189456.696","1160209.279","67","0"
"London,  United Kingdom","London"," United Kingdom","London, Greater London, England, United Kingdom","51.5073219","-0.1276474","189577.728","1160959.439","67","0"
"Dublin,  Ireland","Dublin"," Ireland","Dublin, Dublin 1, Leinster, Ireland","53.3497645","-6.2602732","191637.388","1173725.245","67","0"
"Paris,  France","Paris"," France","Paris, Ile-de-France, Metropolitan France, France","48.8566969","2.3514616","191915.801","1175450.854","67","0"
"Rome,  Italy","Rome"," Italy","Rome, Roma Capitale, Lazio, Italy","41.8933203","12.4829321","192025.021","1176127.804","67","0"
"Valletta,  Malta","Valletta"," Malta","Valletta, South Eastern Region, Malta","35.8989818","14.5136759","199114.221","1220066.791","67","0"
"Addis Ababa,  Ethiopia","Addis Ababa"," Ethiopia","Addis Ababa, 1138, Ethiopia","9.0107934","38.7612525","199427.155","1222006.364","67","0"
"Khartoum,  Sudan","Khartoum"," Sudan","Khartoum, Khartoum State, 11111, Sudan","15.5635972","32.5349123","201091.752","1232323.566","67","0"
"Tripoli,  Libya","Tripoli"," Libya","Tripoli, سوق الجمعة, Tripoli, Libya","32.896672","13.1777923","206001.69","1262755.448","67","0"
"Los Angeles,  United States","Los Angeles"," United States","Los Angeles, Los Angeles County, California, United States","34.0536909","-118.242766","208945.223","1280999.516","67","0"
"Tunisia, Tunisia","Tunisia","Tunisia","Tunisia","33.8439408","9.400138","209776.041","1286148.943","67","0"
"Port Louis,  Mauritius","Port Louis"," Mauritius","Port Louis, 11317, Mauritius","-20.1624522","57.5028044","211277.978","1295457.976","67","0"
"Madrid,  Spain","Madrid"," Spain","Madrid, Área metropolitana de Madrid y Corredor del Henares, Community of Madrid, 28001, Spain","40.4167047","-3.7035825","214179.698","1313442.886","67","0"
"Auckland,  New Zealand","Auckland"," New Zealand","Auckland, Waitematā, Auckland, 1010, New Zealand","-36.852095","174.7631803","214470.368","1315244.464","67","0"
"Nairobi,  Kenya","Nairobi"," Kenya","Nairobi, Kenya","-1.3031689499999999","36.826061224105075","218585.782","1340751.878","67","0"
"Juba,  South Sudan","Juba"," South Sudan","Juba, Central Equatoria, PRIVATE BAG, South Sudan","4.8472017","31.5951655","219021.732","1343453.899","67","0"
"Zanzibar,  Tanzania","Zanzibar"," Tanzania","Zanzibar, Tanzania","-6.09994425","39.32094431715264","221209.768","1357015.39","67","0"
"Avarua,  Cook Islands","Avarua"," Cook Islands","Avarua, Te-Au-O-Tonga, Rarotonga, Cook Islands","-21.2074736","-159.7708145","223304.075","1369995.939","67","0"
"Lisbon,  Portugal","Lisbon"," Portugal","Lisbon, Grande Lisboa, Área Metropolitana de Lisboa, Portugal","38.7077507","-9.1365919","223334.228","1370182.827","67","0"
"Kampala,  Uganda","Kampala"," Uganda","Kampala, Central Region, Uganda","0.3177137","32.5813539","224058.892","1374674.307","67","0"
"Antananarivo,  Madagascar","Antananarivo"," Madagascar","Antananarivo, Analamanga, Province d’Antananarivo, 101, Madagascar","-18.9100122","47.5255809","226067.92","1387126.301","67","0"
"Chicago,  United States","Chicago"," United States","Chicago, Cook County, Illinois, United States","41.8755616","-87.6244212","227297.751","1394748.815","67","0"
"Toronto,  Canada","Toronto"," Canada","Toronto, Golden Horseshoe, Ontario, Canada","43.6534817","-79.3839347","228880.226","1404557.024","67","0"
"Casablanca,  Morocco","Casablanca"," Morocco","Casablanca, Pachalik de Casablanca, Prefecture of Casablanca, Casablanca-Settat, Morocco","33.5950627","-7.6187768","231878.65","1423141.308","67","0"
"Kigali,  Rwanda","Kigali"," Rwanda","Kigali, Nyarugenge District, Kigali City, 2079, Rwanda","-1.950851","30.061507","232198.376","1425122.977","67","0"
"Papeete,  France","Papeete"," France","Papeete, Windward Islands, French Polynesia, 98714, France","-17.5373835","-149.5659964","235348.657","1444648.473","67","0"
"N'Djamena,  Chad","N'Djamena"," Chad","N'Djamena, Chad","12.1191543","15.0502758","237461.65","1457744.843","67","0"
"New York,  United States","New York"," United States","New York, United States","40.7127281","-74.0060152","238481.563","1464066.285","67","0"
"New Orleans,  United States","New Orleans"," United States","New Orleans, Orleans Parish, Louisiana, United States","29.9499323","-90.0701156","250820.269","1540541.805","67","0"
"Harare,  Zimbabwe","Harare"," Zimbabwe","Harare, Harare Province, 04-263, Zimbabwe","-17.831773","31.045686","253917.161","1559736.396","67","0"
"Lusaka,  Zambia","Lusaka"," Zambia","Lusaka, Lusaka District, Lusaka Province, 10101, Zambia","-15.4164488","28.2821535","255522.934","1569689.006","67","0"
"Niamey,  Niger","Niamey"," Niger","Niamey, 8001, Niger","13.524834","2.109823","256459.89","1575496.276","67","0"
"Mexico City,  Mexico","Mexico City"," Mexico","Mexico City, Mexico","19.4326296","-99.1331785","262003.02","1609852.692","67","0"
"Distrito Municipal de KaMpfumo,  Mozambique","Distrito Municipal de KaMpfumo"," Mozambique","Distrito Municipal de KaMpfumo, Maputo, Mozambique","-25.966213","32.56745","262679.124","1614043.196","67","0"
"Congo,  Democratic Republic of the Congo","Congo"," Democratic Republic of the Congo","Congo, Ngaliema, Kinshasa, 24302, Democratic Republic of the Congo","-4.36642155","15.25859008539669","263362.466","1618278.563","67","0"
"Lagos,  Nigeria","Lagos"," Nigeria","Lagos, Lagos Island, Lagos, 100242, Nigeria","6.4550575","3.3941795","266759.264","1639331.981","67","0"
"Nassau,  The Bahamas","Nassau"," The Bahamas","Nassau, New Providence, 242, The Bahamas","25.0783456","-77.3383331","272396.461","1674271.429","67","0"
"Havana,  Cuba","Havana"," Cuba","Havana, Cuba","23.135305","-82.3589631","272746.226","1676439.274","67","0"
"Gaborone,  Botswana","Gaborone"," Botswana","Gaborone, South-East District, 09267, Botswana","-24.6581357","25.9088474","272810.827","1676839.674","67","0"
"Nouakchott,  Mauritania","Nouakchott"," Mauritania","Nouakchott, المفترق, `Arafat, Nouakchott, Mauritania","18.0629628","-15.962910646085763","273000.21","1678013.473","67","0"
"Bamako,  Mali","Bamako"," Mali","Bamako, Kati Cercle, Koulikoro, Mali","12.61326555","-7.984739136241295","273312.739","1679950.537","67","0"
"Luanda,  Angola","Luanda"," Angola","Luanda, Municipality of Luanda, Luanda Province, Angola","-8.8272699","13.2439512","273879.51","1683463.394","67","0"
"Belize City,  Belize","Belize City"," Belize","Belize City, Belize District, Belize","17.5000543","-88.2003115","279149.314","1716125.731","67","0"
"Dakar,  Senegal","Dakar"," Senegal","Dakar, 2084, Senegal","14.693425","-17.447938","281699.981","1731934.81","67","0"
"George Town,  Cayman Islands","George Town"," Cayman Islands","George Town, KY1-9000, Cayman Islands","19.2953549","-81.3807776","282091.297","1734360.197","67","0"
"Guatemala City,  Guatemala","Guatemala City"," Guatemala","Guatemala City, Guatemala Department, 01004, Guatemala","14.6222328","-90.5185188","282493.679","1736854.166","67","0"
"Espargos,  Cape Verde","Espargos"," Cape Verde","Espargos, Sal, 4110, Cape Verde","16.7577983","-22.9431454","283554.55","1743429.463","67","0"
"San Salvador,  El Salvador","San Salvador"," El Salvador","San Salvador, Ayutuxtepeque, Departamento de San Salvador, CP-1101, El Salvador","13.6989939","-89.1914249","285978.57","1758453.581","67","0"
"Freetown,  Sierra Leone","Freetown"," Sierra Leone","Freetown, Western Area Urban, Western Area, 00232, Sierra Leone","8.479004","-13.26795","288733.843","1775530.812","67","0"
"Kingston,  Jamaica","Kingston"," Jamaica","Kingston, Surrey County, KINGSTON, Jamaica","17.9712148","-76.7928128","288903.942","1776585.09","67","0"
"Monrovia,  Liberia","Monrovia"," Liberia","Monrovia, Greater Monrovia, Montserrado County, 231, Liberia","6.328034","-10.797788","289350.208","1779351.058","67","0"
"Santo Domingo,  Dominican Republic","Santo Domingo"," Dominican Republic","Santo Domingo, Distrito Nacional, Dominican Republic","18.4801972","-69.942111","292326.33","1797797.11","67","0"
"Punta Cana,  Dominican Republic","Punta Cana"," Dominican Republic","Punta Cana, Higüey, La Altagracia, 23300, Dominican Republic","18.556551","-68.3691611","292981.86","1801860.098","67","0"
"San Juan,  United States","San Juan"," United States","San Juan, Puerto Rico, United States","18.465299","-66.116666","294244.871","1809688.267","67","0"
"Liberia,  Costa Rica","Liberia"," Costa Rica","Liberia, Cantón Liberia, Provincia Guanacaste, 50101, Costa Rica","10.6333401","-85.4362722","296729.017","1825085.043","67","0"
"Cape Town,  South Africa","Cape Town"," South Africa","Cape Town, City of Cape Town, Western Cape, 8001, South Africa","-33.928992","18.417396","297760.608","1831478.864","67","0"
"Pointe-à-Pitre,  France","Pointe-à-Pitre"," France","Pointe-à-Pitre, Guadeloupe, 97110, France","16.23579555","-61.53207278338337","301155.853","1852522.652","67","0"
"Tocumen,  Panama","Tocumen"," Panama","Tocumen, Distrito Panamá, Panamá, Panama","9.0920363","-79.3816691","306422.894","1885167.866","67","0"
"Caracas,  Venezuela","Caracas"," Venezuela","Caracas, Parroquia Catedral, Municipio Libertador, Capital District, Venezuela","10.506098","-66.9146017","312605.344","1923486.804","67","0"
"Bogota,  Colombia","Bogota"," Colombia","Bogota, Bogota Capital District, 11001, Colombia","4.6533326","-74.083652","321137.678","1976370.366","67","0"
"Quito,  Ecuador","Quito"," Ecuador","Quito, Pichincha, 17041, Ecuador","-0.2201641","-78.5123274","327522.861","2015945.842","67","0"
"Lima,  Peru","Lima"," Peru","Lima, Province of Lima, Lima Metropolitan Area, Lima, Peru","-12.0621065","-77.0365256","354005.055","2180082.954","67","0"
"Santa Cruz,  Bolivia","Santa Cruz"," Bolivia","Santa Cruz, Bolivia","-17.333333","-61.5","380695.758","2345512.409","67","0"
"Rio de Janeiro,  Brazil","Rio de Janeiro"," Brazil","Rio de Janeiro, Região Geográfica Imediata do Rio de Janeiro, Região Metropolitana do Rio de Janeiro, Região Geográfica Intermediária do Rio de Janeiro, Rio de Janeiro, Southeast Region, 20260-080, Brazil","-22.9110137","-43.2093727","390158.495","2404162.625","67","0"
"Santiago,  Chile","Santiago"," Chile","Santiago, Provincia de Santiago, Santiago Metropolitan Region, Chile","-33.4377756","-70.6504502","400542.342","2468521.893","67","0"
"Autonomous City of Buenos Aires,  Argentina","Autonomous City of Buenos Aires"," Argentina","Autonomous City of Buenos Aires, Comuna 6, Autonomous City of Buenos Aires, Argentina","-34.6075682","-58.4370894","421680.67","2599537.627","67","0"
"Montevideo,  Uruguay","Montevideo"," Uruguay","Montevideo, Uruguay","-34.9058916","-56.1913095","424429.139","2616572.691","67","0"