"location","city","country","address","latitude","longitude","co2_kg","distance_km","plane trips_amount","train trips_amount"
"Seoul,  South Korea","Seoul"," South Korea","Seoul, Nowon-gu, South Korea","37.5666791","126.9782914","0.0","0.0","0","67"
"Beijing,  China","Beijing"," China","Beijing, 100051, China","39.906217","116.3912757","28574.68","127800.918","67","0"
"Tokyo,  Japan","Tokyo"," Japan","Tokyo, Japan","35.6828387","139.7594549","31772.857","155267.257","67","0"
"Taipei,  Taiwan","Taipei"," Taiwan","Taipei, Taiwan","25.0375198","121.5636796","37413.325","198903.931","67","0"
"Khabarovsk Krai,  Russia","Khabarovsk Krai"," Russia","Khabarovsk Krai, Far Eastern Federal District, Russia","51.6312684","136.121524","42966.084","230502.765","67","0"
"Ulaanbaatar,  Mongolia","Ulaanbaatar"," Mongolia","Ulaanbaatar, Mongolia","47.94909925","107.02225913456641","49253.844","266284.242","67","0"
"Hong Kong Island,  China","Hong Kong Island"," China","Hong Kong Island, Hong Kong, China","22.2793278","114.1628131","51827.297","280928.872","67","0"
"Municipality of Macau,  China","Municipality of Macau"," China","Municipality of Macau, Macau, China","22.1899448","113.5380454","52857.669","286792.367","67","0"
"Lal-lo,  Philippines","Lal-lo"," Philippines","Lal-lo, Cagayan, Cagayan Valley, 3509, Philippines","18.2000513","121.661997","54614.812","296791.662","67","0"
"Manila,  Philippines","Manila"," Philippines","Manila, Capital District, Metro Manila, Philippines","14.5907332","120.9809674","64308.729","351413.659","67","0"
"Cagayan de Oro,  Philippines","Cagayan de Oro"," Philippines","Cagayan de Oro, Alabang Hills Village, Muntinlupa, Southern Manila District, Metro Manila, 1771, Philippines","14.4373834","121.0303195","64680.442","353503.453","67","0"
"Hanoi,  Vietnam","Hanoi"," Vietnam","Hanoi, Vietnam","21.0294498","105.8544441","67115.212","367191.901","67","0"
"Hagåtña,  United States","Hagåtña"," United States","Hagåtña, Sinajana Municipality, Guam, United States","13.4727446","144.75201822544284","78200.892","429516.378","67","0"
"Phnom Penh,  Cambodia","Phnom Penh"," Cambodia","Phnom Penh, Khan Daun Penh, Phnom Penh, 11213, Cambodia","11.568271","104.9224426","82814.864","486496.638","67","0"
"Bangkok,  Thailand","Bangkok"," Thailand","Bangkok, Phra Borom Maha Ratchawang Subdistrict, Phra Nakhon District, Bangkok, 10200, Thailand","13.7544238","100.4930399","83750.149","498869.463","67","0"
"Dhaka,  Bangladesh","Dhaka"," Bangladesh","Dhaka, Chanpara Bazar, Dhaka District, Dhaka Division, 1230, Bangladesh","23.810651","90.4126466","84387.22","507297.23","67","0"
"Yangon,  Myanmar","Yangon"," Myanmar","Yangon, Western District, Yangon, 11000, Myanmar","16.7967129","96.1609916","84469.495","508385.641","67","0"
"Bandar Seri Begawan,  Brunei","Bandar Seri Begawan"," Brunei","Bandar Seri Begawan, Mukim Kianggeh, Brunei-Muara District, BS8711, Brunei","4.8895453","114.9417574","85147.232","513697.354","67","0"
"Kathmandu,  Nepal","Kathmandu"," Nepal","Kathmandu, Kamaladi Marg, Kamalpokhari, Baghbazar, Kathmandu, Bagmati Pradesh, 46600, Nepal","27.708317","85.3205817","89099.908","538196.105","67","0"
"Bishkek,  Kyrgyzstan","Bishkek"," Kyrgyzstan","Bishkek, Kyrgyzstan","42.8765615","74.6070079","97687.23","591420.481","67","0"
"Nur-Sultan,  Kazakhstan","Nur-Sultan"," Kazakhstan","Nur-Sultan, Kazakhstan","51.1282205","71.4306682","100541.35","609110.37","67","0"
"Kuala Lumpur,  Malaysia","Kuala Lumpur"," Malaysia","Kuala Lumpur, Malaysia","3.1516964","101.6942371","101993.39","618110.142","67","0"
"Singapore, Singapore","Singapore","Singapore","Singapore","1.357107","103.8194992","103263.407","625981.73","67","0"
"New Delhi,  India","New Delhi"," India","New Delhi, Delhi, India","28.6138954","77.2090057","103594.028","628030.921","67","0"
"Islamabad,  Pakistan","Islamabad"," Pakistan","Islamabad, Islamabad Capital Territory, 44000, Pakistan","33.6938118","73.0651511","106581.002","646544.242","67","0"
"Tashkent,  Uzbekistan","Tashkent"," Uzbekistan","Tashkent, 100128, Uzbekistan","41.3123363","69.2787079","107786.274","654014.54","67","0"
"Jakarta Special Capital Region,  Indonesia","Jakarta Special Capital Region"," Indonesia","Jakarta Special Capital Region, Indonesia","-6.1753942","106.827183","116712.664","709340.466","67","0"
"Port Moresby,  Papua New Guinea","Port Moresby"," Papua New Guinea","Port Moresby, National Capital District, Southern Region, 111, Papua New Guinea","-9.4743301","147.1599504","124133.6","755335.556","67","0"
"Colombo,  Sri Lanka","Colombo"," Sri Lanka","Colombo, Main Street, Gas Paha Junction, Kochchikade, St. Bastian, Colombo, Colombo District, Western Province, 01100, Sri Lanka","6.9387469","79.8541134","128430.721","781969.19","67","0"
"Ashgabat,  Turkmenistan","Ashgabat"," Turkmenistan","Ashgabat, Turkmenistan","37.9404648","58.3823487","129476.068","788448.269","67","0"
"Baku,  Azerbaijan","Baku"," Azerbaijan","Baku, Yasamal Raion, Baku City, Absheron, Azerbaijan","40.3754434","49.8326748","141801.463","864841.292","67","0"
"Tehran,  Iran","Tehran"," Iran","Tehran, بخش مرکزی شهرستان تهران, Tehran County, Tehran Province, Iran","35.6892523","51.3896004","143963.546","878241.922","67","0"
"Malé,  Maldives","Malé"," Maldives","Malé, Maldives","4.1779879","73.5107387","144108.111","879137.937","67","0"
"Muscat,  Oman","Muscat"," Oman","Muscat, Oman","23.5882019","58.3829448","145059.024","885031.714","67","0"
"Moscow,  Russia","Moscow"," Russia","Moscow, Central Federal District, Russia","55.7504461","37.6174943","145081.47","885170.831","67","0"
"Tbilisi,  Georgia","Tbilisi"," Georgia","Tbilisi, Georgia","41.6934591","44.8014495","148709.22","907655.692","67","0"
"Dubai,  United Arab Emirates","Dubai"," United Arab Emirates","Dubai, 39205, United Arab Emirates","25.2653471","55.2924914","148808.15","908268.862","67","0"
"Saint Petersburg,  Russia","Saint Petersburg"," Russia","Saint Petersburg, Northwestern Federal District, 190000, Russia","59.938732","30.316229","149414.422","912026.544","67","0"
"Yerevan,  Armenia","Yerevan"," Armenia","Yerevan, Armenia","40.1776121","44.5125849","150803.15","920633.907","67","0"
"Helsinki,  Finland","Helsinki"," Finland","Helsinki, Helsinki sub-region, Uusimaa, Southern Finland, Mainland Finland, Finland","60.1674881","24.9427473","154848.845","945709.194","67","0"
"Doha,  Qatar","Doha"," Qatar","Doha, Qatar","25.2856329","51.5264162","155805.353","951637.652","67","0"
"Tallinn,  Estonia","Tallinn"," Estonia","Tallinn, Harju maakond, Estonia","59.4372155","24.7453688","155937.719","952458.059","67","0"
"Manama,  Bahrain","Manama"," Bahrain","Manama, Capital Governorate, 308, Bahrain","26.2235041","50.5822436","156386.735","955241.07","67","0"
"Dammam Governorate,  Saudi Arabia","Dammam Governorate"," Saudi Arabia","Dammam Governorate, Eastern Region, Saudi Arabia","26.4367824","50.1039991","157004.251","959068.445","67","0"
"Kuwait City,  Kuwait","Kuwait City"," Kuwait","Kuwait City, Al Asimah, 15005, Kuwait","29.3797091","47.9735629","157274.608","960744.119","67","0"
"Baghdad,  Iraq","Baghdad"," Iraq","Baghdad, Al-Karkh Central Subdistrict, Al-Karkh District, Baghdad Governorate, Iraq","33.3024309","44.3787992","158912.574","970896.26","67","0"
"Minsk,  Belarus","Minsk"," Belarus","Minsk, Belarus","53.902334","27.5618791","159496.942","974518.184","67","0"
"Riga,  Latvia","Riga"," Latvia","Riga, Vidzeme, Latvia","56.9493977","24.1051846","159725.491","975934.737","67","0"
"Kyiv,  Ukraine","Kyiv"," Ukraine","Kyiv, Ukraine","50.4500336","30.5241361","159928.967","977195.887","67","0"
"Honolulu,  United States","Honolulu"," United States","Honolulu, Honolulu County, Hawaii, United States","21.304547","-157.855676","160351.775","979816.454","67","0"
"Vilnius,  Lithuania","Vilnius"," Lithuania","Vilnius, Vilnius city municipality, Vilnius County, Lithuania","54.6870458","25.2829111","161249.023","985377.615","67","0"
"Stockholm,  Sweden","Stockholm"," Sweden","Stockholm, Stockholms kommun, Stockholm County, 111 29, Sweden","59.3251172","18.0710935","162944.707","995887.495","67","0"
"Oslo,  Norway","Oslo"," Norway","Oslo, Norway","59.9133301","10.7389701","169102.573","1034054.06","67","0"
"Warsaw,  Poland","Warsaw"," Poland","Warsaw, Masovian Voivodeship, Poland","52.2319581","21.0067249","169615.317","1037232.059","67","0"
"Beirut,  Lebanon","Beirut"," Lebanon","Beirut, Beirut Governorate, Lebanon","33.8959203","35.47843","173355.869","1060416.063","67","0"
"Bucharest,  Romania","Bucharest"," Romania","Bucharest, Romania","44.4361414","26.1027202","173752.784","1062876.147","67","0"
"Copenhagen,  Denmark","Copenhagen"," Denmark","Copenhagen, Copenhagen Municipality, Capital Region of Denmark, 1357, Denmark","55.6867243","12.5700724","173916.713","1063892.187","67","0"
"Istanbul,  Turkey","Istanbul"," Turkey","Istanbul, Fatih, Istanbul, Marmara Region, 34126, Turkey","41.0096334","28.9651646","174243.236","1065915.981","67","0"
"Larnaca Municipality,  Cyprus","Larnaca Municipality"," Cyprus","Larnaca Municipality, Larnaca District, South Cyprus, Cyprus","34.9236095","33.6236184","175067.641","1071025.658","67","0"
"Amman,  Jordan","Amman"," Jordan","Amman, 2062, Jordan","31.9515694","35.9239625","175173.908","1071684.303","67","0"
"Tel Aviv-Yafo,  Israel","Tel Aviv-Yafo"," Israel","Tel Aviv-Yafo, Tel Aviv Subdistrict, Tel Aviv District, Israel","32.0852997","34.7818064","176931.762","1082579.513","67","0"
"Pafos,  Cyprus","Pafos"," Cyprus","Pafos, Paphos Municipality, Paphos District, South Cyprus, 8047, Cyprus","34.7743988","32.4231586","177233.275","1084448.296","67","0"
"Berlin,  Germany","Berlin"," Germany","Berlin, 10117, Germany","52.5170365","13.3888599","177988.65","1089130.122","67","0"
"Vancouver,  Canada","Vancouver"," Canada","Vancouver, District of North Vancouver, British Columbia, Canada","49.2608724","-123.1139529","178703.784","1093562.54","67","0"
"Budapest,  Hungary","Budapest"," Hungary","Budapest, V. kerület, Central Hungary, Hungary","47.4983815","19.0404707","178882.896","1094672.679","67","0"
"Sofia,  Bulgaria","Sofia"," Bulgaria","Sofia, Sofia City, Sofia-City, Bulgaria","42.6978634","23.3221789","180124.371","1102367.362","67","0"
"Bratislava,  Slovakia","Bratislava"," Slovakia","Bratislava, Region of Bratislava, Slovakia","48.1516988","17.1093063","180336.34","1103681.15","67","0"
"Prague,  Czechia","Prague"," Czechia","Prague, Czechia","50.0874654","14.4212535","180605.447","1105349.08","67","0"
"Belgrade,  Serbia","Belgrade"," Serbia","Belgrade, Stari Grad Urban Municipality, City of Belgrade, Central Serbia, 11000, Serbia","44.8178131","20.4568974","180992.712","1107749.354","67","0"
"Vienna,  Austria","Vienna"," Austria","Vienna, Austria","48.2083537","16.3725042","181162.565","1108802.103","67","0"
"Sydney,  Australia","Sydney"," Australia","Sydney, New South Wales, Australia","-33.8548157","151.2164539","182316.912","1115956.766","67","0"
"Reykjavik,  Iceland","Reykjavik"," Iceland","Reykjavik, Capital Region, Iceland","64.145981","-21.9422367","183450.567","1122983.181","67","0"
"Skopje,  North Macedonia","Skopje"," North Macedonia","Skopje, Municipality of Centar, City of Skopje, Skopje Region, North Macedonia","41.9960924","21.4316495","183818.108","1125261.208","67","0"
"City of Sarajevo,  Bosnia and Herzegovina","City of Sarajevo"," Bosnia and Herzegovina","City of Sarajevo, Sarajevo Canton, Federation of Bosnia and Herzegovina, Bosnia and Herzegovina","43.8519774","18.3866868","185223.144","1133969.646","67","0"
"Cairo,  Egypt","Cairo"," Egypt","Cairo, Cairo Governorate, Egypt","30.0443879","31.2357257","185727.108","1137093.227","67","0"
"Podgorica,  Montenegro","Podgorica"," Montenegro","Podgorica, Podgorica Capital City, Montenegro","42.4415238","19.2621081","186174.71","1139867.473","67","0"
"Athens,  Greece","Athens"," Greece","Athens, Municipality of Athens, Regional Unit of Central Athens, Attica, 10667, Greece","37.9839412","23.7283052","186373.824","1141101.58","67","0"
"Ljubljana,  Slovenia","Ljubljana"," Slovenia","Ljubljana, Upravna Enota Ljubljana, 1000, Slovenia","46.0499803","14.5068602","186849.502","1144049.844","67","0"
"Tirana,  Albania","Tirana"," Albania","Tirana, Tirana Municipally, Tirana County, Central Albania, 1001-1028, Albania","41.3279485","19.8185512","187085.741","1145514.058","67","0"
"Amsterdam,  Netherlands","Amsterdam"," Netherlands","Amsterdam, North Holland, Netherlands","52.3727598","4.8936041","187252.611","1146548.323","67","0"
"Luxembourg, Luxembourg","Luxembourg","Luxembourg","Luxembourg","49.8158683","6.1296751","190396.94","1166036.925","67","0"
"Brussels,  Belgium","Brussels"," Belgium","Brussels, City of Brussels, Brussels-Capital, Belgium","50.8465573","4.351697","190478.347","1166541.487","67","0"
"Mahé,  Seychelles","Mahé"," Seychelles","Mahé, Seychelles","-4.68379555","55.49263800753758","190742.009","1168175.671","67","0"
"Hargeisa,  Somalia","Hargeisa"," Somalia","Hargeisa, Hargeisa District, Woqooyi Galbeed, 1100, Somalia","9.561733","44.061803","191221.351","1171146.643","67","0"
"Zurich,  Switzerland","Zurich"," Switzerland","Zurich, District Zurich, Zurich, Switzerland","47.3744489","8.5410422","191877.675","1175214.551","67","0"
"London,  United Kingdom","London"," United Kingdom","London, Greater London, England, United Kingdom","51.5073219","-0.1276474","193760.831","1186886.381","67","0"
"Dublin,  Ireland","Dublin"," Ireland","Dublin, Dublin 1, Leinster, Ireland","53.3497645","-6.2602732","195793.646","1199485.806","67","0"
"Paris,  France","Paris"," France","Paris, Ile-de-France, Metropolitan France, France","48.8566969","2.3514616","196104.635","1201413.323","67","0"
"Rome,  Italy","Rome"," Italy","Rome, Roma Capitale, Lazio, Italy","41.8933203","12.4829321","196149.093","1201688.873","67","0"
"Addis Ababa,  Ethiopia","Addis Ababa"," Ethiopia","Addis Ababa, 1138, Ethiopia","9.0107934","38.7612525","202080.406","1238451.258","67","0"
"Valletta,  Malta","Valletta"," Malta","Valletta, South Eastern Region, Malta","35.8989818","14.5136759","203148.441","1245070.959","67","0"
"Khartoum,  Sudan","Khartoum"," Sudan","Khartoum, Khartoum State, 11111, Sudan","15.5635972","32.5349123","204218.022","1251700.239","67","0"
"Los Angeles,  United States","Los Angeles"," United States","Los Angeles, Los Angeles County, California, United States","34.0536909","-118.242766","209507.947","1284487.29","67","0"
"Tripoli,  Libya","Tripoli"," Libya","Tripoli, سوق الجمعة, Tripoli, Libya","32.896672","13.1777923","210006.272","1287575.92","67","0"
"Auckland,  New Zealand","Auckland"," New Zealand","Auckland, Waitematā, Auckland, 1010, New Zealand","-36.852095","174.7631803","210287.768","1289320.638","67","0"
"Port Louis,  Mauritius","Port Louis"," Mauritius","Port Louis, 11317, Mauritius","-20.1624522","57.5028044","211637.42","1297685.803","67","0"
"Tunisia, Tunisia","Tunisia","Tunisia","Tunisia","33.8439408","9.400138","213837.568","1311322.36","67","0"
"Madrid,  Spain","Madrid"," Spain","Madrid, Área metropolitana de Madrid y Corredor del Henares, Community of Madrid, 28001, Spain","40.4167047","-3.7035825","218366.05","1339389.971","67","0"
"Avarua,  Cook Islands","Avarua"," Cook Islands","Avarua, Te-Au-O-Tonga, Rarotonga, Cook Islands","-21.2074736","-159.7708145","219674.066","1347497.08","67","0"
"Nairobi,  Kenya","Nairobi"," Kenya","Nairobi, Kenya","-1.3031689499999999","36.826061224105075","220827.842","1354648.203","67","0"
"Juba,  South Sudan","Juba"," South Sudan","Juba, Central Equatoria, PRIVATE BAG, South Sudan","4.8472017","31.5951655","221738.094","1360289.96","67","0"
"Zanzibar,  Tanzania","Zanzibar"," Tanzania","Zanzibar, Tanzania","-6.09994425","39.32094431715264","223114.93","1368823.616","67","0"
"Kampala,  Uganda","Kampala"," Uganda","Kampala, Central Region, Uganda","0.3177137","32.5813539","226536.692","1390031.755","67","0"
"Antananarivo,  Madagascar","Antananarivo"," Madagascar","Antananarivo, Analamanga, Province d’Antananarivo, 101, Madagascar","-18.9100122","47.5255809","226942.459","1392546.71","67","0"
"Lisbon,  Portugal","Lisbon"," Portugal","Lisbon, Grande Lisboa, Área Metropolitana de Lisboa, Portugal","38.7077507","-9.1365919","227522.923","1396144.433","67","0"
"Chicago,  United States","Chicago"," United States","Chicago, Cook County, Illinois, United States","41.8755616","-87.6244212","229496.616","1408377.419","67","0"
"Toronto,  Canada","Toronto"," Canada","Toronto, Golden Horseshoe, Ontario, Canada","43.6534817","-79.3839347","231455.779","1420520.35","67","0"
"Papeete,  France","Papeete"," France","Papeete, Windward Islands, French Polynesia, 98714, France","-17.5373835","-149.5659964","232089.3","1424446.921","67","0"
"Kigali,  Rwanda","Kigali"," Rwanda","Kigali, Nyarugenge District, Kigali City, 2079, Rwanda","-1.950851","30.061507","234663.39","1440401.178","67","0"
"Casablanca,  Morocco","Casablanca"," Morocco","Casablanca, Pachalik de Casablanca, Prefecture of Casablanca, Casablanca-Settat, Morocco","33.5950627","-7.6187768","236060.02","1449057.514","67","0"
"N'Djamena,  Chad","N'Djamena"," Chad","N'Djamena, Chad","12.1191543","15.0502758","240957.996","1479415.26","67","0"
"New York,  United States","New York"," United States","New York, United States","40.7127281","-74.0060152","241220.918","1481044.851","67","0"
"New Orleans,  United States","New Orleans"," United States","New Orleans, Orleans Parish, Louisiana, United States","29.9499323","-90.0701156","252546.49","1551240.951","67","0"
"Harare,  Zimbabwe","Harare"," Zimbabwe","Harare, Harare Province, 04-263, Zimbabwe","-17.831773","31.045686","255526.049","1569708.313","67","0"
"Lusaka,  Zambia","Lusaka"," Zambia","Lusaka, Lusaka District, Lusaka Province, 10101, Zambia","-15.4164488","28.2821535","257374.21","1581163.245","67","0"
"Niamey,  Niger","Niamey"," Niger","Niamey, 8001, Niger","13.524834","2.109823","260307.407","1599343.255","67","0"
"Mexico City,  Mexico","Mexico City"," Mexico","Mexico City, Mexico","19.4326296","-99.1331785","262820.151","1614917.287","67","0"
"Distrito Municipal de KaMpfumo,  Mozambique","Distrito Municipal de KaMpfumo"," Mozambique","Distrito Municipal de KaMpfumo, Maputo, Mozambique","-25.966213","32.56745","263748.57","1620671.646","67","0"
"Congo,  Democratic Republic of the Congo","Congo"," Democratic Republic of the Congo","Congo, Ngaliema, Kinshasa, 24302, Democratic Republic of the Congo","-4.36642155","15.25859008539669","266250.788","1636180.433","67","0"
"Lagos,  Nigeria","Lagos"," Nigeria","Lagos, Lagos Island, Lagos, 100242, Nigeria","6.4550575","3.3941795","270408.347","1661949.062","67","0"
"Gaborone,  Botswana","Gaborone"," Botswana","Gaborone, South-East District, 09267, Botswana","-24.6581357","25.9088474","274210.726","1685516.272","67","0"
"Nassau,  The Bahamas","Nassau"," The Bahamas","Nassau, New Providence, 242, The Bahamas","25.0783456","-77.3383331","274681.25","1688432.59","67","0"
"Havana,  Cuba","Havana"," Cuba","Havana, Cuba","23.135305","-82.3589631","274690.363","1688489.073","67","0"
"Luanda,  Angola","Luanda"," Angola","Luanda, Municipality of Luanda, Luanda Province, Angola","-8.8272699","13.2439512","276638.186","1700561.713","67","0"
"Nouakchott,  Mauritania","Nouakchott"," Mauritania","Nouakchott, المفترق, `Arafat, Nouakchott, Mauritania","18.0629628","-15.962910646085763","277168.788","1703850.397","67","0"
"Bamako,  Mali","Bamako"," Mali","Bamako, Kati Cercle, Koulikoro, Mali","12.61326555","-7.984739136241295","277340.923","1704917.293","67","0"
"Belize City,  Belize","Belize City"," Belize","Belize City, Belize District, Belize","17.5000543","-88.2003115","280547.915","1724794.285","67","0"
"Guatemala City,  Guatemala","Guatemala City"," Guatemala","Guatemala City, Guatemala Department, 01004, Guatemala","14.6222328","-90.5185188","283629.612","1743894.698","67","0"
"George Town,  Cayman Islands","George Town"," Cayman Islands","George Town, KY1-9000, Cayman Islands","19.2953549","-81.3807776","283982.407","1746081.328","67","0"
"Dakar,  Senegal","Dakar"," Senegal","Dakar, 2084, Senegal","14.693425","-17.447938","285864.025","1757743.63","67","0"
"San Salvador,  El Salvador","San Salvador"," El Salvador","San Salvador, Ayutuxtepeque, Departamento de San Salvador, CP-1101, El Salvador","13.6989939","-89.1914249","287163.127","1765795.487","67","0"
"Espargos,  Cape Verde","Espargos"," Cape Verde","Espargos, Sal, 4110, Cape Verde","16.7577983","-22.9431454","287743.377","1769391.89","67","0"
"Kingston,  Jamaica","Kingston"," Jamaica","Kingston, Surrey County, KINGSTON, Jamaica","17.9712148","-76.7928128","291050.181","1789887.518","67","0"
"Freetown,  Sierra Leone","Freetown"," Sierra Leone","Freetown, Western Area Urban, Western Area, 00232, Sierra Leone","8.479004","-13.26795","292797.557","1800717.786","67","0"
"Monrovia,  Liberia","Monrovia"," Liberia","Monrovia, Greater Monrovia, Montserrado County, 231, Liberia","6.328034","-10.797788","293338.559","1804070.929","67","0"
"Santo Domingo,  Dominican Republic","Santo Domingo"," Dominican Republic","Santo Domingo, Distrito Nacional, Dominican Republic","18.4801972","-69.942111","294915.953","1813847.642","67","0"
"Punta Cana,  Dominican Republic","Punta Cana"," Dominican Republic","Punta Cana, Higüey, La Altagracia, 23300, Dominican Republic","18.556551","-68.3691611","295668.841","1818514.053","67","0"
"San Juan,  United States","San Juan"," United States","San Juan, Puerto Rico, United States","18.465299","-66.116666","297065.628","1827171.367","67","0"
"Liberia,  Costa Rica","Liberia"," Costa Rica","Liberia, Cantón Liberia, Provincia Guanacaste, 50101, Costa Rica","10.6333401","-85.4362722","298044.758","1833240.035","67","0"
"Cape Town,  South Africa","Cape Town"," South Africa","Cape Town, City of Cape Town, Western Cape, 8001, South Africa","-33.928992","18.417396","298785.413","1837830.623","67","0"
"Pointe-à-Pitre,  France","Pointe-à-Pitre"," France","Pointe-à-Pitre, Guadeloupe, 97110, France","16.23579555","-61.53207278338337","304222.427","1871529.338","67","0"
"Tocumen,  Panama","Tocumen"," Panama","Tocumen, Distrito Panamá, Panamá, Panama","9.0920363","-79.3816691","308119.844","1895685.592","67","0"
"Caracas,  Venezuela","Caracas"," Venezuela","Caracas, Parroquia Catedral, Municipio Libertador, Capital District, Venezuela","10.506098","-66.9146017","315256.617","1939919.44","67","0"
"Bogota,  Colombia","Bogota"," Colombia","Bogota, Bogota Capital District, 11001, Colombia","4.6533326","-74.083652","323095.417","1988504.463","67","0"
"Quito,  Ecuador","Quito"," Ecuador","Quito, Pichincha, 17041, Ecuador","-0.2201641","-78.5123274","328912.128","2024556.544","67","0"
"Lima,  Peru","Lima"," Peru","Lima, Province of Lima, Lima Metropolitan Area, Lima, Peru","-12.0621065","-77.0365256","354847.189","2185302.514","67","0"
"Santa Cruz,  Bolivia","Santa Cruz"," Bolivia","Santa Cruz, Bolivia","-17.333333","-61.5","383154.987","2360754.754","67","0"
"Rio de Janeiro,  Brazil","Rio de Janeiro"," Brazil","Rio de Janeiro, Região Geográfica Imediata do Rio de Janeiro, Região Metropolitana do Rio de Janeiro, Região Geográfica Intermediária do Rio de Janeiro, Rio de Janeiro, Southeast Region, 20260-080, Brazil","-22.9110137","-43.2093727","394347.105","2430123.701","67","0"
"Santiago,  Chile","Santiago"," Chile","Santiago, Provincia de Santiago, Santiago Metropolitan Region, Chile","-33.4377756","-70.6504502","399151.39","2459900.746","67","0"
"Autonomous City of Buenos Aires,  Argentina","Autonomous City of Buenos Aires"," Argentina","Autonomous City of Buenos Aires, Comuna 6, Autonomous City of Buenos Aires, Argentina","-34.6075682","-58.4370894","422293.042","2603333.124","67","0"
"Montevideo,  Uruguay","Montevideo"," Uruguay","Montevideo, Uruguay","-34.9058916","-56.1913095","426119.881","2627051.937","67","0"