"location","city","country","address","latitude","longitude","co2_kg","distance_km","plane trips_amount","train trips_amount"
"Tokyo,  Japan","Tokyo"," Japan","Tokyo, Japan","35.6828387","139.7594549","0.0","0.0","0","67"
"Seoul,  South Korea","Seoul"," South Korea","Seoul, Nowon-gu, South Korea","37.5666791","126.9782914","31772.857","155267.257","67","0"
"Khabarovsk Krai,  Russia","Khabarovsk Krai"," Russia","Khabarovsk Krai, Far Eastern Federal District, Russia","51.6312684","136.121524","44770.362","240770.29","67","0"
"Beijing,  China","Beijing"," China","Beijing, 100051, China","39.906217","116.3912757","51905.262","281372.543","67","0"
"Taipei,  Taiwan","Taipei"," Taiwan","Taipei, Taiwan","25.0375198","121.5636796","51991.896","281865.551","67","0"
"Hagåtña,  United States","Hagåtña"," United States","Hagåtña, Sinajana Municipality, Guam, United States","13.4727446","144.75201822544284","61858.373","337637.585","67","0"
"Lal-lo,  Philippines","Lal-lo"," Philippines","Lal-lo, Cagayan, Cagayan Valley, 3509, Philippines","18.2000513","121.661997","64625.144","353192.568","67","0"
"Hong Kong Island,  China","Hong Kong Island"," China","Hong Kong Island, Hong Kong, China","22.2793278","114.1628131","70640.287","387010.122","67","0"
"Municipality of Macau,  China","Municipality of Macau"," China","Municipality of Macau, Macau, China","22.1899448","113.5380454","72012.15","394722.833","67","0"
"Manila,  Philippines","Manila"," Philippines","Manila, Capital District, Metro Manila, Philippines","14.5907332","120.9809674","73308.845","402012.943","67","0"
"Ulaanbaatar,  Mongolia","Ulaanbaatar"," Mongolia","Ulaanbaatar, Mongolia","47.94909925","107.02225913456641","73444.661","402776.514","67","0"
"Cagayan de Oro,  Philippines","Cagayan de Oro"," Philippines","Cagayan de Oro, Alabang Hills Village, Muntinlupa, Southern Manila District, Metro Manila, 1771, Philippines","14.4373834","121.0303195","73568.701","403473.871","67","0"
"Hanoi,  Vietnam","Hanoi"," Vietnam","Hanoi, Vietnam","21.0294498","105.8544441","83221.74","491879.17","67","0"
"Bandar Seri Begawan,  Brunei","Bandar Seri Begawan"," Brunei","Bandar Seri Begawan, Mukim Kianggeh, Brunei-Muara District, BS8711, Brunei","4.8895453","114.9417574","94450.652","571360.117","67","0"
"Phnom Penh,  Cambodia","Phnom Penh"," Cambodia","Phnom Penh, Khan Daun Penh, Phnom Penh, 11213, Cambodia","11.568271","104.9224426","97551.47","590579.043","67","0"
"Bangkok,  Thailand","Bangkok"," Thailand","Bangkok, Phra Borom Maha Ratchawang Subdistrict, Phra Nakhon District, Bangkok, 10200, Thailand","13.7544238","100.4930399","101917.417","617639.261","67","0"
"Yangon,  Myanmar","Yangon"," Myanmar","Yangon, Western District, Yangon, 11000, Myanmar","16.7967129","96.1609916","105570.507","640281.174","67","0"
"Dhaka,  Bangladesh","Dhaka"," Bangladesh","Dhaka, Chanpara Bazar, Dhaka District, Dhaka Division, 1230, Bangladesh","23.810651","90.4126466","107988.5","655267.937","67","0"
"Port Moresby,  Papua New Guinea","Port Moresby"," Papua New Guinea","Port Moresby, National Capital District, Southern Region, 111, Papua New Guinea","-9.4743301","147.1599504","112115.398","680846.526","67","0"
"Kathmandu,  Nepal","Kathmandu"," Nepal","Kathmandu, Kamaladi Marg, Kamalpokhari, Baghbazar, Kathmandu, Bagmati Pradesh, 46600, Nepal","27.708317","85.3205817","113848.377","691587.56","67","0"
"Singapore, Singapore","Singapore","Singapore","Singapore","1.357107","103.8194992","117263.781","712756.295","67","0"
"Kuala Lumpur,  Malaysia","Kuala Lumpur"," Malaysia","Kuala Lumpur, Malaysia","3.1516964","101.6942371","117386.382","713516.18","67","0"
"Bishkek,  Kyrgyzstan","Bishkek"," Kyrgyzstan","Bishkek, Kyrgyzstan","42.8765615","74.6070079","121705.952","740288.952","67","0"
"Nur-Sultan,  Kazakhstan","Nur-Sultan"," Kazakhstan","Nur-Sultan, Kazakhstan","51.1282205","71.4306682","122542.088","745471.336","67","0"
"Jakarta Special Capital Region,  Indonesia","Jakarta Special Capital Region"," Indonesia","Jakarta Special Capital Region, Indonesia","-6.1753942","106.827183","127384.363","775483.849","67","0"
"New Delhi,  India","New Delhi"," India","New Delhi, Delhi, India","28.6138954","77.2090057","128602.586","783034.411","67","0"
"Islamabad,  Pakistan","Islamabad"," Pakistan","Islamabad, Islamabad Capital Territory, 44000, Pakistan","33.6938118","73.0651511","131541.506","801249.892","67","0"
"Tashkent,  Uzbekistan","Tashkent"," Uzbekistan","Tashkent, 100128, Uzbekistan","41.3123363","69.2787079","131889.534","803406.974","67","0"
"Honolulu,  United States","Honolulu"," United States","Honolulu, Honolulu County, Hawaii, United States","21.304547","-157.855676","136307.193","830787.708","67","0"
"Colombo,  Sri Lanka","Colombo"," Sri Lanka","Colombo, Main Street, Gas Paha Junction, Kochchikade, St. Bastian, Colombo, Colombo District, Western Province, 01100, Sri Lanka","6.9387469","79.8541134","150486.743","918672.811","67","0"
"Ashgabat,  Turkmenistan","Ashgabat"," Turkmenistan","Ashgabat, Turkmenistan","37.9404648","58.3823487","153612.82","938048.293","67","0"
"Moscow,  Russia","Moscow"," Russia","Moscow, Central Federal District, Russia","55.7504461","37.6174943","164042.829","1002693.678","67","0"
"Baku,  Azerbaijan","Baku"," Azerbaijan","Baku, Yasamal Raion, Baku City, Absheron, Azerbaijan","40.3754434","49.8326748","165138.671","1009485.725","67","0"
"Vancouver,  Canada","Vancouver"," Canada","Vancouver, District of North Vancouver, British Columbia, Canada","49.2608724","-123.1139529","165503.591","1011747.504","67","0"
"Saint Petersburg,  Russia","Saint Petersburg"," Russia","Saint Petersburg, Northwestern Federal District, 190000, Russia","59.938732","30.316229","166512.229","1017999.062","67","0"
"Malé,  Maldives","Malé"," Maldives","Malé, Maldives","4.1779879","73.5107387","166604.309","1018569.773","67","0"
"Tehran,  Iran","Tehran"," Iran","Tehran, بخش مرکزی شهرستان تهران, Tehran County, Tehran Province, Iran","35.6892523","51.3896004","168041.875","1027479.836","67","0"
"Muscat,  Oman","Muscat"," Oman","Muscat, Oman","23.5882019","58.3829448","170106.509","1040276.473","67","0"
"Helsinki,  Finland","Helsinki"," Finland","Helsinki, Helsinki sub-region, Uusimaa, Southern Finland, Mainland Finland, Finland","60.1674881","24.9427473","171369.583","1048105.026","67","0"
"Sydney,  Australia","Sydney"," Australia","Sydney, New South Wales, Australia","-33.8548157","151.2164539","171406.872","1048336.147","67","0"
"Tbilisi,  Georgia","Tbilisi"," Georgia","Tbilisi, Georgia","41.6934591","44.8014495","171493.489","1048873.002","67","0"
"Tallinn,  Estonia","Tallinn"," Estonia","Tallinn, Harju maakond, Estonia","59.4372155","24.7453688","172652.454","1056056.287","67","0"
"Dubai,  United Arab Emirates","Dubai"," United Arab Emirates","Dubai, 39205, United Arab Emirates","25.2653471","55.2924914","173793.298","1063127.255","67","0"
"Yerevan,  Armenia","Yerevan"," Armenia","Yerevan, Armenia","40.1776121","44.5125849","173824.751","1063322.205","67","0"
"Riga,  Latvia","Riga"," Latvia","Riga, Vidzeme, Latvia","56.9493977","24.1051846","177074.201","1083462.352","67","0"
"Minsk,  Belarus","Minsk"," Belarus","Minsk, Belarus","53.902334","27.5618791","178026.953","1089367.527","67","0"
"Stockholm,  Sweden","Stockholm"," Sweden","Stockholm, Stockholms kommun, Stockholm County, 111 29, Sweden","59.3251172","18.0710935","178963.237","1095170.631","67","0"
"Vilnius,  Lithuania","Vilnius"," Lithuania","Vilnius, Vilnius city municipality, Vilnius County, Lithuania","54.6870458","25.2829111","179330.894","1097449.377","67","0"
"Kyiv,  Ukraine","Kyiv"," Ukraine","Kyiv, Ukraine","50.4500336","30.5241361","179628.383","1099293.216","67","0"
"Doha,  Qatar","Doha"," Qatar","Doha, Qatar","25.2856329","51.5264162","180714.481","1106024.875","67","0"
"Manama,  Bahrain","Manama"," Bahrain","Manama, Capital Governorate, 308, Bahrain","26.2235041","50.5822436","181227.044","1109201.747","67","0"
"Kuwait City,  Kuwait","Kuwait City"," Kuwait","Kuwait City, Al Asimah, 15005, Kuwait","29.3797091","47.9735629","181813.268","1112835.172","67","0"
"Dammam Governorate,  Saudi Arabia","Dammam Governorate"," Saudi Arabia","Dammam Governorate, Eastern Region, Saudi Arabia","26.4367824","50.1039991","181819.165","1112871.723","67","0"
"Baghdad,  Iraq","Baghdad"," Iraq","Baghdad, Al-Karkh Central Subdistrict, Al-Karkh District, Baghdad Governorate, Iraq","33.3024309","44.3787992","182883.203","1119466.65","67","0"
"Oslo,  Norway","Oslo"," Norway","Oslo, Norway","59.9133301","10.7389701","184059.592","1126757.93","67","0"
"Warsaw,  Poland","Warsaw"," Poland","Warsaw, Masovian Voivodeship, Poland","52.2319581","21.0067249","187822.094","1150077.985","67","0"
"Copenhagen,  Denmark","Copenhagen"," Denmark","Copenhagen, Copenhagen Municipality, Capital Region of Denmark, 1357, Denmark","55.6867243","12.5700724","190187.225","1164737.112","67","0"
"Reykjavik,  Iceland","Reykjavik"," Iceland","Reykjavik, Capital Region, Iceland","64.145981","-21.9422367","192491.352","1179018.133","67","0"
"Los Angeles,  United States","Los Angeles"," United States","Los Angeles, Los Angeles County, California, United States","34.0536909","-118.242766","192754.83","1180651.171","67","0"
"Auckland,  New Zealand","Auckland"," New Zealand","Auckland, Waitematā, Auckland, 1010, New Zealand","-36.852095","174.7631803","193340.729","1184282.587","67","0"
"Bucharest,  Romania","Bucharest"," Romania","Bucharest, Romania","44.4361414","26.1027202","194306.917","1190271.032","67","0"
"Berlin,  Germany","Berlin"," Germany","Berlin, 10117, Germany","52.5170365","13.3888599","195131.865","1195384.079","67","0"
"Istanbul,  Turkey","Istanbul"," Turkey","Istanbul, Fatih, Istanbul, Marmara Region, 34126, Turkey","41.0096334","28.9651646","195774.919","1199369.736","67","0"
"Avarua,  Cook Islands","Avarua"," Cook Islands","Avarua, Te-Au-O-Tonga, Rarotonga, Cook Islands","-21.2074736","-159.7708145","196183.134","1201899.86","67","0"
"Beirut,  Lebanon","Beirut"," Lebanon","Beirut, Beirut Governorate, Lebanon","33.8959203","35.47843","196636.277","1204708.449","67","0"
"Budapest,  Hungary","Budapest"," Hungary","Budapest, V. kerület, Central Hungary, Hungary","47.4983815","19.0404707","197928.44","1212717.3","67","0"
"Larnaca Municipality,  Cyprus","Larnaca Municipality"," Cyprus","Larnaca Municipality, Larnaca District, South Cyprus, Cyprus","34.9236095","33.6236184","198049.98","1213470.605","67","0"
"Prague,  Czechia","Prague"," Czechia","Prague, Czechia","50.0874654","14.4212535","198450.594","1215953.617","67","0"
"Amman,  Jordan","Amman"," Jordan","Amman, 2062, Jordan","31.9515694","35.9239625","198742.018","1217759.867","67","0"
"Bratislava,  Slovakia","Bratislava"," Slovakia","Bratislava, Region of Bratislava, Slovakia","48.1516988","17.1093063","198982.449","1219250.067","67","0"
"Vienna,  Austria","Vienna"," Austria","Vienna, Austria","48.2083537","16.3725042","199695.933","1223672.253","67","0"
"Pafos,  Cyprus","Pafos"," Cyprus","Pafos, Paphos Municipality, Paphos District, South Cyprus, 8047, Cyprus","34.7743988","32.4231586","200132.766","1226379.753","67","0"
"Tel Aviv-Yafo,  Israel","Tel Aviv-Yafo"," Israel","Tel Aviv-Yafo, Tel Aviv Subdistrict, Tel Aviv District, Israel","32.0852997","34.7818064","200395.892","1228010.611","67","0"
"Sofia,  Bulgaria","Sofia"," Bulgaria","Sofia, Sofia City, Sofia-City, Bulgaria","42.6978634","23.3221789","200702.027","1229908.043","67","0"
"Belgrade,  Serbia","Belgrade"," Serbia","Belgrade, Stari Grad Urban Municipality, City of Belgrade, Central Serbia, 11000, Serbia","44.8178131","20.4568974","200789.31","1230449.022","67","0"
"Amsterdam,  Netherlands","Amsterdam"," Netherlands","Amsterdam, North Holland, Netherlands","52.3727598","4.8936041","203149.359","1245076.651","67","0"
"Skopje,  North Macedonia","Skopje"," North Macedonia","Skopje, Municipality of Centar, City of Skopje, Skopje Region, North Macedonia","41.9960924","21.4316495","204301.088","1252215.088","67","0"
"City of Sarajevo,  Bosnia and Herzegovina","City of Sarajevo"," Bosnia and Herzegovina","City of Sarajevo, Sarajevo Canton, Federation of Bosnia and Herzegovina, Bosnia and Herzegovina","43.8519774","18.3866868","204946.239","1256213.743","67","0"
"Ljubljana,  Slovenia","Ljubljana"," Slovenia","Ljubljana, Upravna Enota Ljubljana, 1000, Slovenia","46.0499803","14.5068602","205582.765","1260158.942","67","0"
"Podgorica,  Montenegro","Podgorica"," Montenegro","Podgorica, Podgorica Capital City, Montenegro","42.4415238","19.2621081","206293.73","1264565.515","67","0"
"Brussels,  Belgium","Brussels"," Belgium","Brussels, City of Brussels, Brussels-Capital, Belgium","50.8465573","4.351697","206614.802","1266555.526","67","0"
"Luxembourg, Luxembourg","Luxembourg","Luxembourg","Luxembourg","49.8158683","6.1296751","207044.937","1269221.512","67","0"
"Tirana,  Albania","Tirana"," Albania","Tirana, Tirana Municipally, Tirana County, Central Albania, 1001-1028, Albania","41.3279485","19.8185512","207492.286","1271994.188","67","0"
"Papeete,  France","Papeete"," France","Papeete, Windward Islands, French Polynesia, 98714, France","-17.5373835","-149.5659964","207521.465","1272175.043","67","0"
"Athens,  Greece","Athens"," Greece","Athens, Municipality of Athens, Regional Unit of Central Athens, Attica, 10667, Greece","37.9839412","23.7283052","207869.964","1274335.045","67","0"
"London,  United Kingdom","London"," United Kingdom","London, Greater London, England, United Kingdom","51.5073219","-0.1276474","208992.16","1281290.434","67","0"
"Cairo,  Egypt","Cairo"," Egypt","Cairo, Cairo Governorate, Egypt","30.0443879","31.2357257","209163.134","1282350.136","67","0"
"Zurich,  Switzerland","Zurich"," Switzerland","Zurich, District Zurich, Zurich, Switzerland","47.3744489","8.5410422","209429.222","1283999.354","67","0"
"Dublin,  Ireland","Dublin"," Ireland","Dublin, Dublin 1, Leinster, Ireland","53.3497645","-6.2602732","209541.995","1284698.321","67","0"
"Paris,  France","Paris"," France","Paris, Ile-de-France, Metropolitan France, France","48.8566969","2.3514616","212313.593","1301876.737","67","0"
"Mahé,  Seychelles","Mahé"," Seychelles","Mahé, Seychelles","-4.68379555","55.49263800753758","214048.508","1312629.771","67","0"
"Rome,  Italy","Rome"," Italy","Rome, Roma Capitale, Lazio, Italy","41.8933203","12.4829321","215419.723","1321128.585","67","0"
"Hargeisa,  Somalia","Hargeisa"," Somalia","Hargeisa, Hargeisa District, Woqooyi Galbeed, 1100, Somalia","9.561733","44.061803","216234.942","1326181.327","67","0"
"Chicago,  United States","Chicago"," United States","Chicago, Cook County, Illinois, United States","41.8755616","-87.6244212","221402.52","1358210.067","67","0"
"Valletta,  Malta","Valletta"," Malta","Valletta, South Eastern Region, Malta","35.8989818","14.5136759","223819.704","1373191.816","67","0"
"Toronto,  Canada","Toronto"," Canada","Toronto, Golden Horseshoe, Ontario, Canada","43.6534817","-79.3839347","225951.821","1386406.72","67","0"
"Addis Ababa,  Ethiopia","Addis Ababa"," Ethiopia","Addis Ababa, 1138, Ethiopia","9.0107934","38.7612525","227130.77","1393713.865","67","0"
"Khartoum,  Sudan","Khartoum"," Sudan","Khartoum, Khartoum State, 11111, Sudan","15.5635972","32.5349123","228995.846","1405273.638","67","0"
"Tripoli,  Libya","Tripoli"," Libya","Tripoli, سوق الجمعة, Tripoli, Libya","32.896672","13.1777923","230993.448","1417654.809","67","0"
"Port Louis,  Mauritius","Port Louis"," Mauritius","Port Louis, 11317, Mauritius","-20.1624522","57.5028044","232192.268","1425085.116","67","0"
"Tunisia, Tunisia","Tunisia","Tunisia","Tunisia","33.8439408","9.400138","234089.505","1436844.228","67","0"
"Madrid,  Spain","Madrid"," Spain","Madrid, Área metropolitana de Madrid y Corredor del Henares, Community of Madrid, 28001, Spain","40.4167047","-3.7035825","235016.392","1442589.09","67","0"
"New York,  United States","New York"," United States","New York, United States","40.7127281","-74.0060152","236774.342","1453484.896","67","0"
"New Orleans,  United States","New Orleans"," United States","New Orleans, Orleans Parish, Louisiana, United States","29.9499323","-90.0701156","241149.731","1480603.636","67","0"
"Lisbon,  Portugal","Lisbon"," Portugal","Lisbon, Grande Lisboa, Área Metropolitana de Lisboa, Portugal","38.7077507","-9.1365919","243270.142","1493745.983","67","0"
"Nairobi,  Kenya","Nairobi"," Kenya","Nairobi, Kenya","-1.3031689499999999","36.826061224105075","245662.746","1508575.38","67","0"
"Mexico City,  Mexico","Mexico City"," Mexico","Mexico City, Mexico","19.4326296","-99.1331785","246599.094","1514378.885","67","0"
"Juba,  South Sudan","Juba"," South Sudan","Juba, Central Equatoria, PRIVATE BAG, South Sudan","4.8472017","31.5951655","246787.894","1515549.07","67","0"
"Zanzibar,  Tanzania","Zanzibar"," Tanzania","Zanzibar, Tanzania","-6.09994425","39.32094431715264","247532.856","1520166.357","67","0"
"Antananarivo,  Madagascar","Antananarivo"," Madagascar","Antananarivo, Analamanga, Province d’Antananarivo, 101, Madagascar","-18.9100122","47.5255809","249037.821","1529494.156","67","0"
"Kampala,  Uganda","Kampala"," Uganda","Kampala, Central Region, Uganda","0.3177137","32.5813539","251537.159","1544985.101","67","0"
"Casablanca,  Morocco","Casablanca"," Morocco","Casablanca, Pachalik de Casablanca, Prefecture of Casablanca, Casablanca-Settat, Morocco","33.5950627","-7.6187768","253020.034","1554175.984","67","0"
"Kigali,  Rwanda","Kigali"," Rwanda","Kigali, Nyarugenge District, Kigali City, 2079, Rwanda","-1.950851","30.061507","259655.684","1595303.866","67","0"
"Havana,  Cuba","Havana"," Cuba","Havana, Cuba","23.135305","-82.3589631","264202.143","1623482.896","67","0"
"N'Djamena,  Chad","N'Djamena"," Chad","N'Djamena, Chad","12.1191543","15.0502758","264912.448","1627885.379","67","0"
"Nassau,  The Bahamas","Nassau"," The Bahamas","Nassau, New Providence, 242, The Bahamas","25.0783456","-77.3383331","266346.805","1636775.55","67","0"
"Belize City,  Belize","Belize City"," Belize","Belize City, Belize District, Belize","17.5000543","-88.2003115","266903.787","1640227.738","67","0"
"Guatemala City,  Guatemala","Guatemala City"," Guatemala","Guatemala City, Guatemala Department, 01004, Guatemala","14.6222328","-90.5185188","268618.846","1650857.704","67","0"
"San Salvador,  El Salvador","San Salvador"," El Salvador","San Salvador, Ayutuxtepeque, Departamento de San Salvador, CP-1101, El Salvador","13.6989939","-89.1914249","272333.844","1673883.329","67","0"
"George Town,  Cayman Islands","George Town"," Cayman Islands","George Town, KY1-9000, Cayman Islands","19.2953549","-81.3807776","273005.303","1678045.038","67","0"
"Harare,  Zimbabwe","Harare"," Zimbabwe","Harare, Harare Province, 04-263, Zimbabwe","-17.831773","31.045686","279350.092","1717370.158","67","0"
"Kingston,  Jamaica","Kingston"," Jamaica","Kingston, Surrey County, KINGSTON, Jamaica","17.9712148","-76.7928128","281488.481","1730623.928","67","0"
"Lusaka,  Zambia","Lusaka"," Zambia","Lusaka, Lusaka District, Lusaka Province, 10101, Zambia","-15.4164488","28.2821535","281651.134","1731632.059","67","0"
"Niamey,  Niger","Niamey"," Niger","Niamey, 8001, Niger","13.524834","2.109823","282493.196","1736851.174","67","0"
"Liberia,  Costa Rica","Liberia"," Costa Rica","Liberia, Cantón Liberia, Provincia Guanacaste, 50101, Costa Rica","10.6333401","-85.4362722","283681.129","1744214.001","67","0"
"Distrito Municipal de KaMpfumo,  Mozambique","Distrito Municipal de KaMpfumo"," Mozambique","Distrito Municipal de KaMpfumo, Maputo, Mozambique","-25.966213","32.56745","286216.215","1759926.513","67","0"
"Santo Domingo,  Dominican Republic","Santo Domingo"," Dominican Republic","Santo Domingo, Distrito Nacional, Dominican Republic","18.4801972","-69.942111","288259.028","1772587.9","67","0"
"Punta Cana,  Dominican Republic","Punta Cana"," Dominican Republic","Punta Cana, Higüey, La Altagracia, 23300, Dominican Republic","18.556551","-68.3691611","289709.34","1781576.961","67","0"
"Congo,  Democratic Republic of the Congo","Congo"," Democratic Republic of the Congo","Congo, Ngaliema, Kinshasa, 24302, Democratic Republic of the Congo","-4.36642155","15.25859008539669","291250.246","1791127.525","67","0"
"San Juan,  United States","San Juan"," United States","San Juan, Puerto Rico, United States","18.465299","-66.116666","292095.705","1796367.693","67","0"
"Lagos,  Nigeria","Lagos"," Nigeria","Lagos, Lagos Island, Lagos, 100242, Nigeria","6.4550575","3.3941795","293720.894","1806440.645","67","0"
"Nouakchott,  Mauritania","Nouakchott"," Mauritania","Nouakchott, المفترق, `Arafat, Nouakchott, Mauritania","18.0629628","-15.962910646085763","294447.695","1810945.374","67","0"
"Tocumen,  Panama","Tocumen"," Panama","Tocumen, Distrito Panamá, Panamá, Panama","9.0920363","-79.3816691","295552.28","1817791.607","67","0"
"Gaborone,  Botswana","Gaborone"," Botswana","Gaborone, South-East District, 09267, Botswana","-24.6581357","25.9088474","297501.836","1829874.993","67","0"
"Bamako,  Mali","Bamako"," Mali","Bamako, Kati Cercle, Koulikoro, Mali","12.61326555","-7.984739136241295","297683.798","1831002.794","67","0"
"Pointe-à-Pitre,  France","Pointe-à-Pitre"," France","Pointe-à-Pitre, Guadeloupe, 97110, France","16.23579555","-61.53207278338337","301089.677","1852112.497","67","0"
"Luanda,  Angola","Luanda"," Angola","Luanda, Municipality of Luanda, Luanda Province, Angola","-8.8272699","13.2439512","301684.495","1855799.187","67","0"
"Espargos,  Cape Verde","Espargos"," Cape Verde","Espargos, Sal, 4110, Cape Verde","16.7577983","-22.9431454","302908.372","1863384.8","67","0"
"Dakar,  Senegal","Dakar"," Senegal","Dakar, 2084, Senegal","14.693425","-17.447938","303242.253","1865454.201","67","0"
"Caracas,  Venezuela","Caracas"," Venezuela","Caracas, Parroquia Catedral, Municipio Libertador, Capital District, Venezuela","10.506098","-66.9146017","308522.692","1898182.457","67","0"
"Bogota,  Colombia","Bogota"," Colombia","Bogota, Bogota Capital District, 11001, Colombia","4.6533326","-74.083652","311636.226","1917480.192","67","0"
"Freetown,  Sierra Leone","Freetown"," Sierra Leone","Freetown, Western Area Urban, Western Area, 00232, Sierra Leone","8.479004","-13.26795","312502.529","1922849.553","67","0"
"Monrovia,  Liberia","Monrovia"," Liberia","Monrovia, Greater Monrovia, Montserrado County, 231, Liberia","6.328034","-10.797788","314064.443","1932530.325","67","0"
"Quito,  Ecuador","Quito"," Ecuador","Quito, Pichincha, 17041, Ecuador","-0.2201641","-78.5123274","314274.747","1933833.795","67","0"
"Cape Town,  South Africa","Cape Town"," South Africa","Cape Town, City of Cape Town, Western Cape, 8001, South Africa","-33.928992","18.417396","320899.783","1974895.887","67","0"
"Lima,  Peru","Lima"," Peru","Lima, Province of Lima, Lima Metropolitan Area, Lima, Peru","-12.0621065","-77.0365256","337110.599","2075370.813","67","0"
"Santa Cruz,  Bolivia","Santa Cruz"," Bolivia","Santa Cruz, Bolivia","-17.333333","-61.5","371733.246","2289962.599","67","0"
"Santiago,  Chile","Santiago"," Chile","Santiago, Provincia de Santiago, Santiago Metropolitan Region, Chile","-33.4377756","-70.6504502","374783.055","2308865.368","67","0"
"Autonomous City of Buenos Aires,  Argentina","Autonomous City of Buenos Aires"," Argentina","Autonomous City of Buenos Aires, Comuna 6, Autonomous City of Buenos Aires, Argentina","-34.6075682","-58.4370894","399177.488","2460062.505","67","0"
"Rio de Janeiro,  Brazil","Rio de Janeiro"," Brazil","Rio de Janeiro, Região Geográfica Imediata do Rio de Janeiro, Região Metropolitana do Rio de Janeiro, Região Geográfica Intermediária do Rio de Janeiro, Rio de Janeiro, Southeast Region, 20260-080, Brazil","-22.9110137","-43.2093727","403666.209","2487883.674","67","0"
"Montevideo,  Uruguay","Montevideo"," Uruguay","Montevideo, Uruguay","-34.9058916","-56.1913095","403670.448","2487909.953","67","0"