"location","city","country","address","latitude","longitude","co2_kg","distance_km","plane trips_amount","train trips_amount"
"Valletta,  Malta","Valletta"," Malta","Valletta, South Eastern Region, Malta","35.8989818","14.5136759","0.0","0.0","0","67"
"Tripoli,  Libya","Tripoli"," Libya","Tripoli, سوق الجمعة, Tripoli, Libya","32.896672","13.1777923","1424.824","47652.99","0","67"
"Tunisia, Tunisia","Tunisia","Tunisia","Tunisia","33.8439408","9.400138","17471.361","69594.295","67","0"
"Rome,  Italy","Rome"," Italy","Rome, Roma Capitale, Lazio, Italy","41.8933203","12.4829321","21819.52","92360.726","67","0"
"Tirana,  Albania","Tirana"," Albania","Tirana, Tirana Municipally, Tirana County, Central Albania, 1001-1028, Albania","41.3279485","19.8185512","23608.768","101729.013","67","0"
"Podgorica,  Montenegro","Podgorica"," Montenegro","Podgorica, Podgorica Capital City, Montenegro","42.4415238","19.2621081","25534.23","111810.504","67","0"
"Athens,  Greece","Athens"," Greece","Athens, Municipality of Athens, Regional Unit of Central Athens, Attica, 10667, Greece","37.9839412","23.7283052","25950.914","113992.207","67","0"
"Skopje,  North Macedonia","Skopje"," North Macedonia","Skopje, Municipality of Centar, City of Skopje, Skopje Region, North Macedonia","41.9960924","21.4316495","27303.502","121074.195","67","0"
"City of Sarajevo,  Bosnia and Herzegovina","City of Sarajevo"," Bosnia and Herzegovina","City of Sarajevo, Sarajevo Canton, Federation of Bosnia and Herzegovina, Bosnia and Herzegovina","43.8519774","18.3866868","28333.373","126466.478","67","0"
"Sofia,  Bulgaria","Sofia"," Bulgaria","Sofia, Sofia City, Sofia-City, Bulgaria","42.6978634","23.3221789","30378.963","143296.327","67","0"
"Belgrade,  Serbia","Belgrade"," Serbia","Belgrade, Stari Grad Urban Municipality, City of Belgrade, Central Serbia, 11000, Serbia","44.8178131","20.4568974","31036.009","148939.118","67","0"
"Ljubljana,  Slovenia","Ljubljana"," Slovenia","Ljubljana, Upravna Enota Ljubljana, 1000, Slovenia","46.0499803","14.5068602","31305.243","151251.33","67","0"
"Budapest,  Hungary","Budapest"," Hungary","Budapest, V. kerület, Central Hungary, Hungary","47.4983815","19.0404707","34651.518","179937.459","67","0"
"Bucharest,  Romania","Bucharest"," Romania","Bucharest, Romania","44.4361414","26.1027202","35029.911","182939.939","67","0"
"Zurich,  Switzerland","Zurich"," Switzerland","Zurich, District Zurich, Zurich, Switzerland","47.3744489","8.5410422","35078.491","183325.413","67","0"
"Vienna,  Austria","Vienna"," Austria","Vienna, Austria","48.2083537","16.3725042","35232.253","184545.488","67","0"
"Istanbul,  Turkey","Istanbul"," Turkey","Istanbul, Fatih, Istanbul, Marmara Region, 34126, Turkey","41.0096334","28.9651646","35253.799","184716.453","67","0"
"Bratislava,  Slovakia","Bratislava"," Slovakia","Bratislava, Region of Bratislava, Slovakia","48.1516988","17.1093063","35262.367","184784.437","67","0"
"Prague,  Czechia","Prague"," Czechia","Prague, Czechia","50.0874654","14.4212535","39611.461","211412.764","67","0"
"Pafos,  Cyprus","Pafos"," Cyprus","Pafos, Paphos Municipality, Paphos District, South Cyprus, 8047, Cyprus","34.7743988","32.4231586","40774.011","218028.434","67","0"
"Madrid,  Spain","Madrid"," Spain","Madrid, Área metropolitana de Madrid y Corredor del Henares, Community of Madrid, 28001, Spain","40.4167047","-3.7035825","41703.831","223319.718","67","0"
"Cairo,  Egypt","Cairo"," Egypt","Cairo, Cairo Governorate, Egypt","30.0443879","31.2357257","42193.976","226108.966","67","0"
"Luxembourg, Luxembourg","Luxembourg","Luxembourg","Luxembourg","49.8158683","6.1296751","42234.784","226341.192","67","0"
"Larnaca Municipality,  Cyprus","Larnaca Municipality"," Cyprus","Larnaca Municipality, Larnaca District, South Cyprus, Cyprus","34.9236095","33.6236184","43255.944","232152.26","67","0"
"Paris,  France","Paris"," France","Paris, Ile-de-France, Metropolitan France, France","48.8566969","2.3514616","43634.322","234305.476","67","0"
"Brussels,  Belgium","Brussels"," Belgium","Brussels, City of Brussels, Brussels-Capital, Belgium","50.8465573","4.351697","46021.64","247890.88","67","0"
"Berlin,  Germany","Berlin"," Germany","Berlin, 10117, Germany","52.5170365","13.3888599","46022.32","247894.753","67","0"
"Warsaw,  Poland","Warsaw"," Poland","Warsaw, Masovian Voivodeship, Poland","52.2319581","21.0067249","46892.237","252845.147","67","0"
"Tel Aviv-Yafo,  Israel","Tel Aviv-Yafo"," Israel","Tel Aviv-Yafo, Tel Aviv Subdistrict, Tel Aviv District, Israel","32.0852997","34.7818064","47490.513","256249.73","67","0"
"Beirut,  Lebanon","Beirut"," Lebanon","Beirut, Beirut Governorate, Lebanon","33.8959203","35.47843","47699.171","257437.134","67","0"
"Amsterdam,  Netherlands","Amsterdam"," Netherlands","Amsterdam, North Holland, Netherlands","52.3727598","4.8936041","49133.192","265597.653","67","0"
"Amman,  Jordan","Amman"," Jordan","Amman, 2062, Jordan","31.9515694","35.9239625","50007.163","270571.122","67","0"
"Casablanca,  Morocco","Casablanca"," Morocco","Casablanca, Pachalik de Casablanca, Prefecture of Casablanca, Casablanca-Settat, Morocco","33.5950627","-7.6187768","50353.694","272543.107","67","0"
"Kyiv,  Ukraine","Kyiv"," Ukraine","Kyiv, Ukraine","50.4500336","30.5241361","51092.05","276744.835","67","0"
"London,  United Kingdom","London"," United Kingdom","London, Greater London, England, United Kingdom","51.5073219","-0.1276474","51638.254","279853.097","67","0"
"Lisbon,  Portugal","Lisbon"," Portugal","Lisbon, Grande Lisboa, Área Metropolitana de Lisboa, Portugal","38.7077507","-9.1365919","52122.143","282606.74","67","0"
"Copenhagen,  Denmark","Copenhagen"," Denmark","Copenhagen, Copenhagen Municipality, Capital Region of Denmark, 1357, Denmark","55.6867243","12.5700724","54388.173","295501.936","67","0"
"Minsk,  Belarus","Minsk"," Belarus","Minsk, Belarus","53.902334","27.5618791","55254.362","300431.118","67","0"
"Vilnius,  Lithuania","Vilnius"," Lithuania","Vilnius, Vilnius city municipality, Vilnius County, Lithuania","54.6870458","25.2829111","55361.523","301040.936","67","0"
"Riga,  Latvia","Riga"," Latvia","Riga, Vidzeme, Latvia","56.9493977","24.1051846","60147.593","328019.458","67","0"
"Dublin,  Ireland","Dublin"," Ireland","Dublin, Dublin 1, Leinster, Ireland","53.3497645","-6.2602732","61964.221","338232.671","67","0"
"Stockholm,  Sweden","Stockholm"," Sweden","Stockholm, Stockholms kommun, Stockholm County, 111 29, Sweden","59.3251172","18.0710935","64192.238","350758.739","67","0"
"N'Djamena,  Chad","N'Djamena"," Chad","N'Djamena, Chad","12.1191543","15.0502758","64839.256","354396.319","67","0"
"Yerevan,  Armenia","Yerevan"," Armenia","Yerevan, Armenia","40.1776121","44.5125849","65127.587","356017.338","67","0"
"Oslo,  Norway","Oslo"," Norway","Oslo, Norway","59.9133301","10.7389701","65775.641","359660.741","67","0"
"Tbilisi,  Georgia","Tbilisi"," Georgia","Tbilisi, Georgia","41.6934591","44.8014495","65863.217","360153.1","67","0"
"Tallinn,  Estonia","Tallinn"," Estonia","Tallinn, Harju maakond, Estonia","59.4372155","24.7453688","66631.39","364471.821","67","0"
"Baghdad,  Iraq","Baghdad"," Iraq","Baghdad, Al-Karkh Central Subdistrict, Al-Karkh District, Baghdad Governorate, Iraq","33.3024309","44.3787992","67062.66","366896.45","67","0"
"Niamey,  Niger","Niamey"," Niger","Niamey, 8001, Niger","13.524834","2.109823","68050.622","372450.843","67","0"
"Helsinki,  Finland","Helsinki"," Finland","Helsinki, Helsinki sub-region, Uusimaa, Southern Finland, Mainland Finland, Finland","60.1674881","24.9427473","68538.299","375192.601","67","0"
"Moscow,  Russia","Moscow"," Russia","Moscow, Central Federal District, Russia","55.7504461","37.6174943","68880.45","377116.196","67","0"
"Khartoum,  Sudan","Khartoum"," Sudan","Khartoum, Khartoum State, 11111, Sudan","15.5635972","32.5349123","70502.862","386237.509","67","0"
"Saint Petersburg,  Russia","Saint Petersburg"," Russia","Saint Petersburg, Northwestern Federal District, 190000, Russia","59.938732","30.316229","71009.989","389088.613","67","0"
"Baku,  Azerbaijan","Baku"," Azerbaijan","Baku, Yasamal Raion, Baku City, Absheron, Azerbaijan","40.3754434","49.8326748","75874.859","416439.254","67","0"
"Kuwait City,  Kuwait","Kuwait City"," Kuwait","Kuwait City, Al Asimah, 15005, Kuwait","29.3797091","47.9735629","78053.93","428690.143","67","0"
"Tehran,  Iran","Tehran"," Iran","Tehran, بخش مرکزی شهرستان تهران, Tehran County, Tehran Province, Iran","35.6892523","51.3896004","80597.085","442987.943","67","0"
"Dammam Governorate,  Saudi Arabia","Dammam Governorate"," Saudi Arabia","Dammam Governorate, Eastern Region, Saudi Arabia","26.4367824","50.1039991","81737.78","472190.441","67","0"
"Manama,  Bahrain","Manama"," Bahrain","Manama, Capital Governorate, 308, Bahrain","26.2235041","50.5822436","82272.668","479323.971","67","0"
"Bamako,  Mali","Bamako"," Mali","Bamako, Kati Cercle, Koulikoro, Mali","12.61326555","-7.984739136241295","82307.608","459890.423","67","0"
"Nouakchott,  Mauritania","Nouakchott"," Mauritania","Nouakchott, المفترق, `Arafat, Nouakchott, Mauritania","18.0629628","-15.962910646085763","82387.331","480840.834","67","0"
"Lagos,  Nigeria","Lagos"," Nigeria","Lagos, Lagos Island, Lagos, 100242, Nigeria","6.4550575","3.3941795","82658.759","464286.928","67","0"
"Doha,  Qatar","Doha"," Qatar","Doha, Qatar","25.2856329","51.5264162","83605.234","496952.391","67","0"
"Addis Ababa,  Ethiopia","Addis Ababa"," Ethiopia","Addis Ababa, 1138, Ethiopia","9.0107934","38.7612525","85887.438","518285.162","67","0"
"Juba,  South Sudan","Juba"," South Sudan","Juba, Central Equatoria, PRIVATE BAG, South Sudan","4.8472017","31.5951655","85938.903","518604.143","67","0"
"Ashgabat,  Turkmenistan","Ashgabat"," Turkmenistan","Ashgabat, Turkmenistan","37.9404648","58.3823487","85942.296","518625.172","67","0"
"Dakar,  Senegal","Dakar"," Senegal","Dakar, 2084, Senegal","14.693425","-17.447938","87754.064","529854.54","67","0"
"Reykjavik,  Iceland","Reykjavik"," Iceland","Reykjavik, Capital Region, Iceland","64.145981","-21.9422367","88158.974","532364.185","67","0"
"Dubai,  United Arab Emirates","Dubai"," United Arab Emirates","Dubai, 39205, United Arab Emirates","25.2653471","55.2924914","89750.757","542230.082","67","0"
"Freetown,  Sierra Leone","Freetown"," Sierra Leone","Freetown, Western Area Urban, Western Area, 00232, Sierra Leone","8.479004","-13.26795","91975.325","556017.996","67","0"
"Monrovia,  Liberia","Monrovia"," Liberia","Monrovia, Greater Monrovia, Montserrado County, 231, Liberia","6.328034","-10.797788","92620.78","560018.533","67","0"
"Hargeisa,  Somalia","Hargeisa"," Somalia","Hargeisa, Hargeisa District, Woqooyi Galbeed, 1100, Somalia","9.561733","44.061803","92653.244","560219.745","67","0"
"Espargos,  Cape Verde","Espargos"," Cape Verde","Espargos, Sal, 4110, Cape Verde","16.7577983","-22.9431454","94338.601","570665.621","67","0"
"Kampala,  Uganda","Kampala"," Uganda","Kampala, Central Region, Uganda","0.3177137","32.5813539","96851.043","586237.78","67","0"
"Muscat,  Oman","Muscat"," Oman","Muscat, Oman","23.5882019","58.3829448","97613.486","590963.419","67","0"
"Congo,  Democratic Republic of the Congo","Congo"," Democratic Republic of the Congo","Congo, Ngaliema, Kinshasa, 24302, Democratic Republic of the Congo","-4.36642155","15.25859008539669","99079.59","600050.356","67","0"
"Kigali,  Rwanda","Kigali"," Rwanda","Kigali, Nyarugenge District, Kigali City, 2079, Rwanda","-1.950851","30.061507","99715.806","603993.635","67","0"
"Tashkent,  Uzbekistan","Tashkent"," Uzbekistan","Tashkent, 100128, Uzbekistan","41.3123363","69.2787079","104264.214","632184.751","67","0"
"Nairobi,  Kenya","Nairobi"," Kenya","Nairobi, Kenya","-1.3031689499999999","36.826061224105075","104723.163","635029.321","67","0"
"Nur-Sultan,  Kazakhstan","Nur-Sultan"," Kazakhstan","Nur-Sultan, Kazakhstan","51.1282205","71.4306682","105102.04","637377.608","67","0"
"Luanda,  Angola","Luanda"," Angola","Luanda, Municipality of Luanda, Luanda Province, Angola","-8.8272699","13.2439512","109827.464","666665.872","67","0"
"Bishkek,  Kyrgyzstan","Bishkek"," Kyrgyzstan","Bishkek, Kyrgyzstan","42.8765615","74.6070079","112796.364","685067.167","67","0"
"Islamabad,  Pakistan","Islamabad"," Pakistan","Islamabad, Islamabad Capital Territory, 44000, Pakistan","33.6938118","73.0651511","116208.657","706216.618","67","0"
"Zanzibar,  Tanzania","Zanzibar"," Tanzania","Zanzibar, Tanzania","-6.09994425","39.32094431715264","117714.402","715549.252","67","0"
"New Delhi,  India","New Delhi"," India","New Delhi, Delhi, India","28.6138954","77.2090057","128780.175","784135.114","67","0"
"Lusaka,  Zambia","Lusaka"," Zambia","Lusaka, Lusaka District, Lusaka Province, 10101, Zambia","-15.4164488","28.2821535","129544.934","788875.104","67","0"
"Mahé,  Seychelles","Mahé"," Seychelles","Mahé, Seychelles","-4.68379555","55.49263800753758","136486.491","831899.0","67","0"
"Harare,  Zimbabwe","Harare"," Zimbabwe","Harare, Harare Province, 04-263, Zimbabwe","-17.831773","31.045686","136806.617","833883.142","67","0"
"Kathmandu,  Nepal","Kathmandu"," Nepal","Kathmandu, Kamaladi Marg, Kamalpokhari, Baghbazar, Kathmandu, Bagmati Pradesh, 46600, Nepal","27.708317","85.3205817","145166.338","885696.843","67","0"
"Gaborone,  Botswana","Gaborone"," Botswana","Gaborone, South-East District, 09267, Botswana","-24.6581357","25.9088474","150131.388","916470.317","67","0"
"Malé,  Maldives","Malé"," Maldives","Malé, Maldives","4.1779879","73.5107387","152966.572","934042.836","67","0"
"Antananarivo,  Madagascar","Antananarivo"," Madagascar","Antananarivo, Analamanga, Province d’Antananarivo, 101, Madagascar","-18.9100122","47.5255809","153936.543","940054.736","67","0"
"Distrito Municipal de KaMpfumo,  Mozambique","Distrito Municipal de KaMpfumo"," Mozambique","Distrito Municipal de KaMpfumo, Maputo, Mozambique","-25.966213","32.56745","156533.761","956152.34","67","0"
"Dhaka,  Bangladesh","Dhaka"," Bangladesh","Dhaka, Chanpara Bazar, Dhaka District, Dhaka Division, 1230, Bangladesh","23.810651","90.4126466","159337.827","973531.988","67","0"
"Ulaanbaatar,  Mongolia","Ulaanbaatar"," Mongolia","Ulaanbaatar, Mongolia","47.94909925","107.02225913456641","160189.358","978809.791","67","0"
"Colombo,  Sri Lanka","Colombo"," Sri Lanka","Colombo, Main Street, Gas Paha Junction, Kochchikade, St. Bastian, Colombo, Colombo District, Western Province, 01100, Sri Lanka","6.9387469","79.8541134","160991.846","983783.629","67","0"
"New York,  United States","New York"," United States","New York, United States","40.7127281","-74.0060152","162197.328","991255.229","67","0"
"Toronto,  Canada","Toronto"," Canada","Toronto, Golden Horseshoe, Ontario, Canada","43.6534817","-79.3839347","167175.352","1022109.108","67","0"
"Port Louis,  Mauritius","Port Louis"," Mauritius","Port Louis, 11317, Mauritius","-20.1624522","57.5028044","168769.649","1031990.588","67","0"
"Pointe-à-Pitre,  France","Pointe-à-Pitre"," France","Pointe-à-Pitre, Guadeloupe, 97110, France","16.23579555","-61.53207278338337","169156.603","1034388.937","67","0"
"Cape Town,  South Africa","Cape Town"," South Africa","Cape Town, City of Cape Town, Western Cape, 8001, South Africa","-33.928992","18.417396","170362.73","1041864.538","67","0"
"San Juan,  United States","San Juan"," United States","San Juan, Puerto Rico, United States","18.465299","-66.116666","175096.251","1071202.984","67","0"
"Yangon,  Myanmar","Yangon"," Myanmar","Yangon, Western District, Yangon, 11000, Myanmar","16.7967129","96.1609916","179237.149","1096868.344","67","0"
"Punta Cana,  Dominican Republic","Punta Cana"," Dominican Republic","Punta Cana, Higüey, La Altagracia, 23300, Dominican Republic","18.556551","-68.3691611","179286.997","1097177.3","67","0"
"Chicago,  United States","Chicago"," United States","Chicago, Cook County, Illinois, United States","41.8755616","-87.6244212","181745.908","1112417.675","67","0"
"Santo Domingo,  Dominican Republic","Santo Domingo"," Dominican Republic","Santo Domingo, Distrito Nacional, Dominican Republic","18.4801972","-69.942111","182386.565","1116388.479","67","0"
"Beijing,  China","Beijing"," China","Beijing, 100051, China","39.906217","116.3912757","184069.305","1126818.135","67","0"
"Caracas,  Venezuela","Caracas"," Venezuela","Caracas, Parroquia Catedral, Municipio Libertador, Capital District, Venezuela","10.506098","-66.9146017","187279.85","1146717.149","67","0"
"Nassau,  The Bahamas","Nassau"," The Bahamas","Nassau, New Providence, 242, The Bahamas","25.0783456","-77.3383331","187394.074","1147425.11","67","0"
"Khabarovsk Krai,  Russia","Khabarovsk Krai"," Russia","Khabarovsk Krai, Far Eastern Federal District, Russia","51.6312684","136.121524","191427.278","1172422.982","67","0"
"Bangkok,  Thailand","Bangkok"," Thailand","Bangkok, Phra Borom Maha Ratchawang Subdistrict, Phra Nakhon District, Bangkok, 10200, Thailand","13.7544238","100.4930399","191654.104","1173828.853","67","0"
"Hanoi,  Vietnam","Hanoi"," Vietnam","Hanoi, Vietnam","21.0294498","105.8544441","191915.266","1175447.539","67","0"
"Rio de Janeiro,  Brazil","Rio de Janeiro"," Brazil","Rio de Janeiro, Região Geográfica Imediata do Rio de Janeiro, Região Metropolitana do Rio de Janeiro, Região Geográfica Intermediária do Rio de Janeiro, Rio de Janeiro, Southeast Region, 20260-080, Brazil","-22.9110137","-43.2093727","195072.315","1195014.983","67","0"
"Kingston,  Jamaica","Kingston"," Jamaica","Kingston, Surrey County, KINGSTON, Jamaica","17.9712148","-76.7928128","196027.327","1200934.17","67","0"
"Havana,  Cuba","Havana"," Cuba","Havana, Cuba","23.135305","-82.3589631","199107.549","1220025.439","67","0"
"New Orleans,  United States","New Orleans"," United States","New Orleans, Orleans Parish, Louisiana, United States","29.9499323","-90.0701156","202613.275","1241753.991","67","0"
"George Town,  Cayman Islands","George Town"," Cayman Islands","George Town, KY1-9000, Cayman Islands","19.2953549","-81.3807776","202719.566","1242412.785","67","0"
"Seoul,  South Korea","Seoul"," South Korea","Seoul, Nowon-gu, South Korea","37.5666791","126.9782914","203148.441","1245070.959","67","0"
"Phnom Penh,  Cambodia","Phnom Penh"," Cambodia","Phnom Penh, Khan Daun Penh, Phnom Penh, 11213, Cambodia","11.568271","104.9224426","203179.106","1245261.022","67","0"
"Municipality of Macau,  China","Municipality of Macau"," China","Municipality of Macau, Macau, China","22.1899448","113.5380454","204303.983","1252233.031","67","0"
"Hong Kong Island,  China","Hong Kong Island"," China","Hong Kong Island, Hong Kong, China","22.2793278","114.1628131","205292.919","1258362.471","67","0"
"Kuala Lumpur,  Malaysia","Kuala Lumpur"," Malaysia","Kuala Lumpur, Malaysia","3.1516964","101.6942371","208698.833","1279472.385","67","0"
"Bogota,  Colombia","Bogota"," Colombia","Bogota, Bogota Capital District, 11001, Colombia","4.6533326","-74.083652","209346.388","1283485.944","67","0"
"Vancouver,  Canada","Vancouver"," Canada","Vancouver, District of North Vancouver, British Columbia, Canada","49.2608724","-123.1139529","211225.12","1295130.361","67","0"
"Tocumen,  Panama","Tocumen"," Panama","Tocumen, Distrito Panamá, Panamá, Panama","9.0920363","-79.3816691","213348.662","1308292.114","67","0"
"Taipei,  Taiwan","Taipei"," Taiwan","Taipei, Taiwan","25.0375198","121.5636796","214087.121","1312869.092","67","0"
"Singapore, Singapore","Singapore","Singapore","Singapore","1.357107","103.8194992","215363.328","1320779.048","67","0"
"Santa Cruz,  Bolivia","Santa Cruz"," Bolivia","Santa Cruz, Bolivia","-17.333333","-61.5","216947.806","1330599.673","67","0"
"Belize City,  Belize","Belize City"," Belize","Belize City, Belize District, Belize","17.5000543","-88.2003115","217761.011","1335639.929","67","0"
"Liberia,  Costa Rica","Liberia"," Costa Rica","Liberia, Cantón Liberia, Provincia Guanacaste, 50101, Costa Rica","10.6333401","-85.4362722","222673.449","1366087.311","67","0"
"Tokyo,  Japan","Tokyo"," Japan","Tokyo, Japan","35.6828387","139.7594549","223819.704","1373191.816","67","0"
"Lal-lo,  Philippines","Lal-lo"," Philippines","Lal-lo, Cagayan, Cagayan Valley, 3509, Philippines","18.2000513","121.661997","224656.123","1378375.96","67","0"
"Quito,  Ecuador","Quito"," Ecuador","Quito, Pichincha, 17041, Ecuador","-0.2201641","-78.5123274","224830.3","1379455.51","67","0"
"San Salvador,  El Salvador","San Salvador"," El Salvador","San Salvador, Ayutuxtepeque, Departamento de San Salvador, CP-1101, El Salvador","13.6989939","-89.1914249","225186.746","1381664.77","67","0"
"Guatemala City,  Guatemala","Guatemala City"," Guatemala","Guatemala City, Guatemala Department, 01004, Guatemala","14.6222328","-90.5185188","226244.463","1388220.518","67","0"
"Manila,  Philippines","Manila"," Philippines","Manila, Capital District, Metro Manila, Philippines","14.5907332","120.9809674","228900.023","1404679.725","67","0"
"Cagayan de Oro,  Philippines","Cagayan de Oro"," Philippines","Cagayan de Oro, Alabang Hills Village, Muntinlupa, Southern Manila District, Metro Manila, 1771, Philippines","14.4373834","121.0303195","229220.666","1406667.078","67","0"
"Jakarta Special Capital Region,  Indonesia","Jakarta Special Capital Region"," Indonesia","Jakarta Special Capital Region, Indonesia","-6.1753942","106.827183","231813.994","1422740.571","67","0"
"Bandar Seri Begawan,  Brunei","Bandar Seri Begawan"," Brunei","Bandar Seri Begawan, Mukim Kianggeh, Brunei-Muara District, BS8711, Brunei","4.8895453","114.9417574","231886.321","1423188.857","67","0"
"Mexico City,  Mexico","Mexico City"," Mexico","Mexico City, Mexico","19.4326296","-99.1331785","233993.093","1436246.662","67","0"
"Montevideo,  Uruguay","Montevideo"," Uruguay","Montevideo, Uruguay","-34.9058916","-56.1913095","234644.481","1440283.981","67","0"
"Los Angeles,  United States","Los Angeles"," United States","Los Angeles, Los Angeles County, California, United States","34.0536909","-118.242766","236207.427","1449971.148","67","0"
"Autonomous City of Buenos Aires,  Argentina","Autonomous City of Buenos Aires"," Argentina","Autonomous City of Buenos Aires, Comuna 6, Autonomous City of Buenos Aires, Argentina","-34.6075682","-58.4370894","237633.546","1458810.26","67","0"
"Lima,  Peru","Lima"," Peru","Lima, Province of Lima, Lima Metropolitan Area, Lima, Peru","-12.0621065","-77.0365256","238526.43","1464344.37","67","0"
"Santiago,  Chile","Santiago"," Chile","Santiago, Provincia de Santiago, Santiago Metropolitan Region, Chile","-33.4377756","-70.6504502","255729.651","1570970.238","67","0"
"Hagåtña,  United States","Hagåtña"," United States","Hagåtña, Sinajana Municipality, Guam, United States","13.4727446","144.75201822544284","271167.379","1666653.554","67","0"
"Honolulu,  United States","Honolulu"," United States","Honolulu, Honolulu County, Hawaii, United States","21.304547","-157.855676","296378.838","1822914.631","67","0"
"Port Moresby,  Papua New Guinea","Port Moresby"," Papua New Guinea","Port Moresby, National Capital District, Southern Region, 111, Papua New Guinea","-9.4743301","147.1599504","313897.446","1931495.278","67","0"
"Sydney,  Australia","Sydney"," Australia","Sydney, New South Wales, Australia","-33.8548157","151.2164539","350155.882","2156225.71","67","0"
"Papeete,  France","Papeete"," France","Papeete, Windward Islands, French Polynesia, 98714, France","-17.5373835","-149.5659964","379330.247","2337048.947","67","0"
"Auckland,  New Zealand","Auckland"," New Zealand","Auckland, Waitematā, Auckland, 1010, New Zealand","-36.852095","174.7631803","396760.087","2445079.41","67","0"
"Avarua,  Cook Islands","Avarua"," Cook Islands","Avarua, Te-Au-O-Tonga, Rarotonga, Cook Islands","-21.2074736","-159.7708145","397686.224","2450819.622","67","0"